title,newspaper,url,published_at,plain_text,keyword,relevance_score,source,mh_matches,covid_matches
Cómo afrontar la ansiedad y el estrés que nos produce la pandemia,lavanguardia.com,https://www.lavanguardia.com/magazine/experiencias/20201019/33857/terribilitis.html,2020-10-19 08:00:00+00:00,"Tu explorador está configurado para bloquear JavaScript. Para usar nuestros servicios, es necesario que lo permitas.

Cómo afrontar la ansiedad y el estrés que nos produce la pandemia

Psicólogos y expertos ofrecen consejos para evitar que los períodos de restricciones o el temor a ser contagiado por el virus causen estrés y preocupaciones excesivas que puedan paralizar o aumentar el sufrimiento

La incertidumbre provocada por la pandemia está alumbrando, dicen los expertos, un monstruo con varias cabezas (la salud, el trabajo, los hijos …) que anticipa amenazas reales o imaginarias. ¿Y si pierdo el trabajo?, ¿Y si la covid-19 afecta mi capacidad pulmonar? ¿Y si…? Una situación que motiva que proliferen iniciativas cada vez más efervescentes para mantener la calma. El último grito son los llamados consultores espirituales que comienzan a proliferar en EE.UU. y que mezclan el lenguaje de lo sagrado con el lenguaje de la consultoría de gestión para ofrecer a los teletrabajadores la posibilidad de compartir sus preocupaciones y obtener soporte espiritual.

También se están popularizando calcomanías con la llamada plegaria de la serenidad: “Dios, concédeme la serenidad para aceptar las cosas que no puedo cambiar, el valor para cambiar las cosas que puedo cambiar y la sabiduría para conocer la diferencia”. Según parece, su autor, el teólogo Reinhold Niebuhr, escribió el texto en 1943 para combatir la ansiedad que provocaba la II Guerra Mundial.

“Estamos en el momento de más ansiedad generalizada de la historia moderna”, aprecia el escritor y periodista Miralles

Pero si los consejeros espirituales norteamericanos forman parte de la parafernalia que ha traído la covid-19, es posible que la frase de Niebuhr encierre una enseñanza provechosa. “Estamos en el momento de más ansiedad generalizada de la historia moderna”, aprecia Francesc Miralles, escritor y periodista especializado en psicología, toda vez que autor de libros como Todo saldrá bien (Cúpula).

En opinión de este experto, el deseo insatisfecho de estabilidad y la dificultad de prever futuro está llevando a lo que los budistas denominan “mente de mono”, esto es, a saltar de pensamiento en pensamiento en función de lo que sucede en el exterior y a caer en la terribilitis, el término que usa el psicólogo Rafael Santandreu para nombrar la tendencia a pensar que todo irá a peor. “En cambio, hay culturas que saben que lo bueno y lo malo que sucede es temporal, por lo que perciben el presente como ver pasar nubes sobre un lienzo blanco”, ejemplifica.

Las culturas urbanas son más histéricas por culpa de la inmediatez y el control, mientras las tradicionales están habituadas al cambio

Miralles se ha referido en ocasiones al “zen del asfalto” para dar a entender que es en las ciudades donde más falta hace la tranquilidad. “Lo que podría llamarse el zen del asfalto es una invitación a buscar la paz y la lucidez, en medio de una metrópoli ruidosa”, indica. “Las culturas urbanas son más histéricas, porque son culturas de la inmediatez, donde todo es más cuadriculado. En cambio, las culturas tradicionales contemplan el cambio como parte fundamental de la vida, en tanto están acostumbradas a fluir con el clima y a perder las cosechas por causas meteorológicas, a diferencia de las urbanas, que son más artificiales y, por lo tanto, tienen un deseo permanente de control y de que todo suceda de una determinada manera”, apostilla. Visto así, una posible moraleja es que, pese a la dificultad de la empresa, hay que intentar vivir con la máxima serenidad la pandemia.

Miralles pone como ejemplo al escritor Gaspar Hernández, autor de libros como El oficio de vivir bien (Aguilar) o El silencio, obra con la que ganó el Premio Josep Pla en 2009. “Cuando entrevisté a Gaspar Hernández, me dijo que la pandemia le sorprendió durante el lanzamiento de su nuevo libro, cuando ya tenía un montón de charlas programadas, presentaciones y entrevistas, y que todo se le vino debajo de repente, lo que le sumió en un estado de ansiedad que le llevó a pensar que el libro fracasaría”, relata. “Gaspar me dijo entonces algo interesante: hay que abolir el futuro cuando no lo puedes controlar. Es decir, prohibirse a uno mismo el tiempo futuro y ocuparse solamente del día en curso”, explica.

Posiblemente, alcanzar la serenidad en tiempos de coronavirus se está convirtiendo en una de las piedras filosofales del momento presente, como demuestra la gran producción editorial centrada en conseguir la ataraxia, la palabra que utilizaban los antiguos griegos para tener autodominio sobre los acontecimientos externos, fueran cuales fuesen.

Otro tanto piensa Patricia Ramírez, “una psicóloga de la vida cotidiana” –según se define– autora de libros como Cuenta contigo (Conecta) y, anteriormente, de Educar con serenidad (Grijalbo) o Entrénate para la vida (Espasa), entre otras obras. “Sobre cómo alcanzar la serenidad y combatir la ansiedad, hay libros maravillosos como La trampa de la felicidad (Planeta), de Russ Harris, o Sal de tu mente, entra en tu vida (Desclée De Brouwer), de Steven C. Hayes”, aconseja esta psicóloga.

También a Ramírez el coronavirus le cogió con el pie cambiado. Al respecto, no deja de ser curioso observar cómo están predicando con el ejemplo los propios psicólogos a la hora de poner en práctica durante el coronavirus los consejos que posteriormente ofrecen a sus clientes en la consulta. Porque…¿hay algo bueno en no tener la vida bajo control?

“Yo, por ejemplo, me he reinventado”, contesta Ramírez. “Antes de la pandemia tenía montada mi actividad de puertas afuera, porque había dejado de ver a pacientes y me dedicaba a dar conferencias en empresas, a mis intervenciones en radio y televisión y a la obra de teatro que había montado con Silvia Congost: Diez maneras de cargarte tu relación de pareja. Pero se anuló todo…”, prosigue. “Así que decidí reinventarme y montar una plataforma para impartir talleres virtuales que ha funcionado muy bien, porque ahora llego a Latinoamérica. Asimismo, como no podía abarcar tantos pacientes, he montado una consulta virtual con ocho compañeras. A mi, la falta de control sobre cosas que tenía muy controladas, me ha dado una perspectiva de trabajo distinta”, admite.

No obstante, si se trata de aconsejar sobre cómo sortear la ansiedad anticipatoria que está provocando el coronavirus por no saber que ocurrirá mañana, los expertos proponen no perder de vista estas estrategias:

Cuando reina el desorden exterior, tener un orden interior puede atenuar el desasosiego, recuerda Ramírez. “Se trata de fomentar un orden personal basado en rutinas que den seguridad. Puede tratarse de guardar unos horarios, de tener la casa ordenada o de tirar cosas que sobren, es decir, de que el hogar no sea un caos, porque cuando hay confusión y desorden en el exterior, es necesario un orden interior”, reflexiona.

“Durante mi vida, he sufrido muchas desgracias que nunca llegaron a suceder”, señaló en su día el escritor norteamericano Mark Twain, autor de libros inolvidables como El príncipe y el mendigo, Un yankee en la corte del rey Arturo, Las aventuras de Tom Sawyer o Las aventuras de Huckleberry Finn. Esta frase de Mark Twain es muy celebrada entre los expertos en psicología por prevenir del peligro de anticipar el futuro. Hay otras sentencias parecidas como, por ejemplo, “Desear lo mejor, recelar lo peor y tomar lo que viniere”, como sugería el pintor francés Eugène Delacroix. Es decir, concurren tantas variables, que aunque exista la tendencia a pensar que el problema aparecerá por un lado, lo más común es que surja por un lugar imprevisto. “Viene a ser algo parecido a lo que dicen los porteros: la pelota nunca acaba entrando por dónde uno había pensado”, recuerda Miralles esbozando un símil futbolístico.

Hay que mirar de frente a la intranquilidad y cortarle las alas. En opinión de Ramírez, si una persona piensa que acabará contagiándose de coronavirus (o que le sucederá cualquier otra desgracia relacionada con la pandemia…) es más probable que suceda. “El consejo es poner distancia con las cavilaciones negativas, a ser posible con sentido del humor”, sugiere. “Mi recomendación para quienes tienen estos pensamientos es que le digan a su mente: “Qué cansina eres, todo el día anticipándome desgracias, que si pasará esto, que si pasará lo otro. Si no te importa, voy a pensar en otra cosa y luego, si tengo tiempo y me apetece, igual te escucharé otra vez. Ahora no es el momento”, propone. Como pequeña nota a pie de página, hablar solo en voz alta “es sanísimo”, tranquiliza Ramírez, “especialmente si son palabras serenas que ayudan a relacionarse con uno mismo”.

Conviene concentrarse en las cosas que se pueden controlar y no obsesionarse con las que no. “Por ejemplo, si tu hijo va al colegio y en su clase hay un positivo, lo controlable es llevarlo al hospital a que le hagan la PCR, mientras que lo incontrolable es pasarse tres días comiéndose las uñas en espera de saber el resultado. Conviene controlar únicamente lo que está en nuestras manos”, argumenta.

Pensar ocasionalmente en lo peor puede ayudar a amortiguar los miedos. Imaginar alguna vez el peor de los escenarios puede contribuir a que, llegado el momento, no coja por sorpresa y servir para preparar un plan alternativo. Sin embargo, el consejo de Ramírez es no imaginarse ni lo peor ni lo mejor, sino fluir por el presente.

Las grandes victorias siempre son psicológicas pero no hay que poner todos los huevos en el cesto de la mente. “Aunque la actitud es muy importante, no hay que volcar todo el peso en la mente, porque no todo el mundo tiene las mismas circunstancias socio-económicas o culturales”, advierte Ramírez. “Creo que es meter mucha presión a la gente decirle que todo se puede solucionar con una actitud positiva”, opina. En resumidas cuentas: no centrarlo todo en la cabeza, sino también ocuparse del cuerpo. Por ejemplo, “llevar una alimentación saludable, practicar actividad física y tener un sueño reparador para que los neurotransmisores relacionados con la relajación y el bienestar puedan regularse”, sugiere esta experta.

Hay que evitar luchar contra aquello que nos irrita. Los psicólogos llaman meta-emoción a la idea de que cada vez que luchamos contra una emoción emanamos otras emociones posteriores. Es decir, “al enfadarnos por la situación que vivimos nos enfadamos al mismo tiempo por estar enfadados, lo que propicia un segundo nivel de malestar”, explica Miralles. En opinión de este experto, no se trata de luchar contra una emoción, sino de dejarla fluir sin aferrarse a ella, para no entrar en un bucle negativo.

Practicar la meditación formal o…informal. Porque…¿hay otros caminos para mantener la calma que no pasen por la ortodoxia espiritual? Según indica Miralles, un profesor de yoga de Los Angeles, Arthur Jeon, abordó este tema en “Dharma urbano” (Ediciones B). He aquí uno de los consejos de este californiano: “observe sus pensamientos con distancia y no los confunda con la realidad. Así será capaz de distinguir lo neurótico de lo útil”. Otro consejo: “Sea consciente de que cualquier cosa que suceda, buena o mala, cambiará”. Un tercero: “Huya de la idea de que en la ciudad vive amenazado por las personas y las situaciones”. Puesto que la serenidad es un estado mental, Jeon sostiene que “el sufrimiento no lo generan las personas que nos rodean ni el lugar en el que nos encontramos, sino la lectura que hacemos de lo que nos sucede”, anota en su libro. Respecto a la posibilidad de meditar informalmente, Ramírez propone poner los cinco sentidos en una única tarea (y pone de ejemplo “cortar verdura” o “darse una ducha sin pensar en otra cosa que no sea la temperatura del agua y la sensación que produce”) para experimentar el aquí y ahora y no proyectarse hacia el pasado o el futuro.

Ser resiliente. El término está de moda desde hace tiempo. Luis Rojas Marcos, profesor de Psiquiatría en la Universidad de Nueva York, dedicó en su día un libro (Superar la adversidad: el poder de la resiliencia) a este concepto proveniente de la metalurgia que nombra la capacidad de adaptación de un ser vivo frente a un agente perturbador o situación adversa. La segunda acepción del término, según la Real Academia Española, es la capacidad de un material, mecanismo o sistema para recuperar su estado inicial cuando ha cesado la perturbación a la que había estado sometido. Así pues, se trata de adaptarse lo mejor posible a una situación complicada, en lugar de “romperse”.

Inspirarse en culturas más serenas. La cultura asiática enseña que la mayor o menor gravedad de un acontecimiento reside en la manera de filtrarlo a través la mente, lo que podría explicar que algunas personas se ahoguen en un vaso de agua, mientras otras se sobreponen ante las mismas adversidades. Hace unos años, Lonely Planet impulsó un libro titulado Calm. Secretos para la serenidad a través de las culturas del mundo (GeoPlaneta). Según puede leerse en esta obra, “la serenidad no está en ninguna parte y está en todas. No está en un lugar, está en la búsqueda” y tanto puede encontrarse “renunciando al control del entorno seguro, como cuando uno baila hacia atrás en un tango argentino”, como “dándole un masaje shiatsu a un gato”.","covid, coronavirus, pandemia",100.0,GDELT,ansiedad;estres;estrés;psicologo;psicólogo,covid;covid-19;coronavirus;pandemia
La Fiscalía de Las Palmas separa a niños migrantes de sus madres hasta dos meses a la espera de pruebas de ADN,eldiario.es,https://www.eldiario.es/canariasahora/365-dias-de-migraciones/salimata-diez-ninos-migrantes-separados-madres-canarias-espera-pruebas-adn_132_6306776.html,2020-10-21 13:45:00+00:00,"La Fiscalía de Las Palmas separa a niños migrantes de sus madres hasta dos meses a la espera de pruebas de ADN

Faith (nombre ficticio) sobrevivió con dos años a la ruta migratoria canaria. Después de una peligrosa travesía por mar, desembarcó junto a su madre en el muelle de Arguineguín, al sur de Gran Canaria, donde hasta el momento permanecen cerca de 900 personas. En el precario campamento de emergencia que funciona como punto de paso para los migrantes que esperan una plaza de acogida, Faith fue separada de su madre por orden de la Fiscalía de Las Palmas y trasladada a un centro para menores extranjeros no acompañados gestionado por el Gobierno de Canarias, hasta que una prueba de ADN confirme que la mujer que atravesó el océano junto a ella es su madre. La progenitora fue trasladada a uno de los complejos extrahoteleros habilitados por la Delegación del Gobierno, pero las horas separadas de la niña fueron menos de las previstas. Tuvieron que ser reunidas de forma urgente, ya que la menor sufrió un ataque de ansiedad y dejó de comer y de dormir. Como ella, diez niños más han sido separados de sus familiares a la espera de las pruebas, un test que se realiza en la Península y cuyos resultados pueden demorarse meses. Esta práctica solo se da en la provincia de Las Palmas.

El fiscal superior de Canarias, Luis del Río, explica que en la actualidad se está revisando este protocolo. “Estamos estudiando por qué se hace en Las Palmas y si esto es lo más adecuado. La prueba tarda, y si realmente son madre e hijo, esta separación durante tanto tiempo puede ser contraproducente”, subraya. El protocolo seguido en este caso se ha repetido hasta en diez ocasiones en los últimos meses en Gran Canaria y Fuerteventura. La Consejería de Derechos Sociales ha rechazado y cuestionado estas separaciones: “En Tenerife no se hace”. El departamento que dirige Noemí Santana y que tiene competencias en materia de menores extranjeros no acompañados ha exigido a la Fiscalía de Menores de la provincia de Las Palmas un criterio claro y por escrito.

En Gran Canaria, además de Faith, cinco menores más llegados la semana pasada se encuentran en la misma situación. En Fuerteventura, se contabilizan seis casos que llegaron a la isla a finales de agosto. Entre ellos Salimata, que con dos años es la más pequeña del grupo. Todos ellos proceden de Costa de Marfil y Guinea Conakry y tienen entre dos y diez años. En septiembre se sometieron a la prueba de ADN, y el pasado viernes 16 de octubre se confirmó que cuatro de los niños sí habían venido con sus madres. Sin embargo, cinco días más tarde, aún no se ha reagrupado a los cuatro niños y a sus madres. En los otros dos casos, alcanzaron el Archipiélago acompañados de una tía y de una hermana mayor. Para ellos, el Ejecutivo regional pedirá el acogimiento en familia extensa, un permiso otorgado cuando existe una relación de parentesco por consanguinidad o por afinidad hasta el tercer grado entre el menor y los solicitantes del acogimiento.

La fiscal jefa de la provincia de Las Palmas, Beatriz Sánchez, explica que este protocolo es una “medida de precaución” aplicada como consecuencia de sucesos pasados, en los que se localizó a personas que utilizaban a los niños para conseguir arraigos en Canarias o para llevarlos a Europa para traficar con menores. “Es una indicación del fiscal de Sala del Tribunal Supremo”, asevera. “Si el menor no puede decir que es su madre, se procede a la separación. Se toman muestras de ADN y se establece un régimen de visitas, que con la pandemia provocada por la COVID-19 ha pasado a ser más restringido”, explica. Mientras tanto, los niños pasan a ocupar plazas de acogida de la Consejería de Derechos Sociales previstas para menores extranjeros no acompañados. Según la fiscal jefa, se han celebrado reuniones con Cruz Roja, la Delegación del Gobierno y la Dirección General de Protección a la Infancia y a la Familia y “están todos de acuerdo”. “El propósito es proteger al menor”, insiste. Según datos del Gobierno regional, actualmente hay 1.200 menores migrantes alojados en 15 recursos del Ejecutivo, con la previsión de que este miércoles se abra un nuevo establecimiento.

El Ministerio del Interior ha explicado a Canarias Ahora que en España “solo se actúa en los casos puntuales en los que existen dudas sobre una alegada relación entre un menor y otra persona”. “El protocolo es el mismo para toda España. Pasa por realizar pruebas de ADN, con autorización de la Fiscalía en caso del menor. Mientras se espera al resultado de la prueba, el menor permanece a cargo de los servicios de acogida. Se obra en consecuencia a los resultados. Si son familia, se mantiene la unidad y se tramita según la situación legal en la que se encuentren. Si no son familia, el menor entra en el registro de menores no acompañados y se le aplica el protocolo establecido para estos supuestos”, detallan fuentes del departamento liderado por Fernando Grande-Marlaska.

El colectivo Caminando Fronteras explica que esta práctica, que fue común en Andalucía, produce “mucho dolor” tanto para las madres como para los hijos y supone una “vulneración del derecho a la familia y la infancia” por el hecho de ser mujer, negra y llegar en patera. “Quitar al niño de las manos de su madre es un proceso rápido, pero devolvérselo una vez se ha demostrado la maternidad es un procedimiento lento. Hemos visto casos de una separación que dura hasta seis meses con niños de muy corta edad. Incluso lactantes que estaban mamando de su propia madre y se le quitaba de sus brazos, argumentando que era para proteger a los niños utilizando la excusa de que las madres podían estar siendo víctimas de trata y que si ellas decidían irse con la red, que los niños no acabaran en el mismo destino”, apunta el colectivo. En el caso de Canarias, actualmente ese riesgo “aparentemente no existiría”: “Las madres están ahí bloqueadas”.

En otros puntos del país, como Melilla, también se han producido estas separaciones, tal y como ha publicado elDiario.es. Fue el caso de Hizia, una mujer de origen argelino que llegó a la ciudad en septiembre de 2016 embarazada de dos meses y con un niño de tres años. Cruzó la frontera desde Marruecos con un pasaporte falso y la ingresaron en un calabozo. Dos días después, recuperó su libertad y fue al centro de acogida en el que se encontraba su hijo. No le permitieron llevárselo, ni tampoco verle, hasta que se acreditara la relación materno-filial. “Esta mujer dice que el menor es su hijo, pero no aporta ninguna documentación. No podemos arriesgarnos a que el niño desaparezca con alguien que no es su madre”, argumentó el consejero de Bienestar Social de Meilla, Daniel Ventura, en declaraciones recogidas por elDiario.es. Un mes más tarde, las pruebas de ADN confirmaron que eran madre e hijo. En 2017, la costamarfileña Oumo logró reagruparse con su hijo de cuatro años tras siete meses separados. Las autoridades de Melilla impidieron que la mujer pudiera ver al menor y hablar con él por teléfono tras llegar en pateras diferentes a España.","covid, coronavirus, pandemia",20.0,GDELT,ansiedad,covid;covid-19;pandemia
Murcia baraja aplicar restricciones a tres municipios y detecta un nuevo brote tras una comida multitudinaria,eldiario.es,https://www.eldiario.es/murcia/sociedad/murcia-baraja-aplicar-restricciones-tres-municipios-detecta-nuevo-brote-comida-multitudinaria_1_6313018.html,2020-10-22 15:30:00+00:00,"Murcia baraja aplicar restricciones a tres municipios y detecta un nuevo brote tras una comida multitudinaria

El consejero de Salud, Manuel Villegas, ha dicho este jueves en rueda de prensa posterior al Consejo de Gobierno que en el comité Covid regional han destacado la situación preocupante que viven además de Murcia capital y Molina de Segura, los municipios de Cieza, Torre Pacheco y Beniel, en los que probablemente se adoptarán medidas restrictivas la semana próxima.

Según evolucionen este fin de semana Cieza, Torre Pacheco y Beniel, quizás sea necesario adoptar medidas mas restrictivas en esos tres ayuntamientos, por lo que hace un llamamiento a esos vecinos para que extremen las medidas de prevención y protección.

Además anunció que se han dado por controlados los dos brotes descubiertos en las secciones de Psiquiatría y Oncología del hospital Morales Meseguer de Murcia, sobre las que sospechan que se produjeron por las visitas, que han sido suspendidas temporalmente. En concreto, dieron positivo siete pacientes de Oncología y uno de Psiquiatría y se encuentran en cuarentena 12 y 4 trabajadores de ambas secciones, respectivamente, realizándose pruebas PCR a los contactos estrechos.

Por otro lado, a los 180 habitantes de Calar de la Santa (Moratalla) se les realizarán pruebas PCR debido a un brote detectado en el pueblo debido a una comida de jóvenes que acudieron a un local social donde se reúne la mayoría de la población y en el que se presume que se produjo el contagio.

Respecto a la residencia de mayores Ballesol de Altorreal (Molina), hay 79 residentes afectados, parte de los cuales han sido trasladados a otros centros y la propia residencia ha sido medicalizada para atender al resto.

Esta semana se han detectado 154 brotes en la Región de Murcia con mas de mil casos asociados, lo que supone un porcentaje de trazabilidad del 70 por ciento, según Villegas, un porcentaje que sitúa a Murcia como la primera autonomía con números casos estrechos asociados a brotes declarados, “lo que dice mucho del excelente trabajo del servicio de epidemiología”. Ese dato es uno de los indicadores al parecer del plan que elabora el gobierno central y los autonómicos para la respuesta coordinada que tratará este tarde el Consejo Interterritorial de Salud.

Villegas comentó que el primer borrador del plan se elaboró el pasado día 14 y contenía más concreción que el que se lleva esta tarde a la interterritorial, y advirtió que la mayoría de medidas ya se están aplicando en la Región de Murcia “de facto. Es más, han servido como referencia para su inclusión en el borrador de trabajo”, agregó, y remarcó que “la población lo que hace es confundirla” con las diferencias en cada autonomía.

Recordó que en julio pidieron al Estado que consensuara medidas comunes en todo el territorio nacional para dar repuesta coordinada a situaciones de transmisión y que aporten seguridad a todos los ciudadanos de que independientemente de donde vivan se aplicará unas medias comunes porque, según dijo, “la coordinación entre administraciones es vital para una lucha eficaz contra la pandemia que evite que se descontrole el contagio y que se sigan produciendo muertes a este ritmo”.

Preguntado por la huelga de médicos convocada a nivel nacional y regional el próximo día 27, respondió que no creía que vaya a tener aquí demasido éxito porque no tiene repercusión en la Región la normativa contra la que ha sido convocada y que se elaboró ante la ausencia de facultativos suficientes en esta pandemia.","covid, coronavirus, pandemia",30.0,GDELT,psiquiatria;psiquiatría,covid;pandemia;cuarentena
