"title","newspaper","url","published_at","plain_text","keyword","relevance_score","source","mh_matches","covid_matches"
"Coronavirus : radiografía de la alarma social según nuestras búsquedas en internet","lavanguardia.com","https://www.lavanguardia.com/vida/20200313/474097773348/coronavirus-radiografia-alarma-social-busquedas-internet.html","2020-03-13 06:45:00+00:00","De cero a 100 en menos de cuatro meses. El Coronavirus ha pasado de ser un suceso remoto en la China central a convertirse en una amenaza que captura más de 6 millones de búsquedas en Google y supera los 4 millones de lectores en un sólo día.

Hay muy pocas ocasiones donde un suceso informativo llegue a reunir tantas entradas en el motor de búsqueda: en los últimos tres años tan solo ha sido superado por el seguimiento del rescate de Julen, el niño atrapado en un pozo de un municipio de Málaga, que logró acumular hasta 14,3 millones de búsquedas en un solo día.

El día que el virus dio el salto en la península se multiplicaron por cinco las búsquedas en Google

Con la implementación de las nuevas medidas para contener la epidemia y el precedente de Italia, que se ha visto obligada confinar todo el país, el Coronavirus va en camino de batir récords.

Hasta el momento pico de lectores se dio este martes 11 de marzo, coincidiendo con el segundo día de bloqueo de Italia y la suspensión de la actividad docente en Madrid y Vitoria, cuando más de 3,9 millones de usuarios únicos entraron en La Vanguardia para leer las últimas noticias relacionadas con el brote.

El interés por el Covid-19, sin embargo, se mantiene disparado desde el día 26 de febrero cuando el Ministerio de Sanidad confirmó el primer caso en la península: se trataba de un hombre de 62 años que no había viajado a ninguna zona de riesgo y que confirmaba el peor pronóstico: el virus llevaba varios días circulando en España sin haber sido detectado.

Ese día un total de 2,7millones de usuarios consultaron La Vanguardia para informarse de la cuestión. También en Google las búsquedas se multiplicaron por cinco, se focalizaron en conocer los síntomas de la enfermedad y el avance del brote en España.

“La retransmisión en tiempo real de la epidemia hace difícil que el componente emocional no se imponga al racional”

“La retransmisión en tiempo real de la evolución de la epidemia tanto en España como en el resto del mundo hace difícil que el componente emocional (la alarma) no se imponga al racional (la alerta), explica Antoni Plasència, médico epidemiólogo y Director General de ISGlobal, un centro impulsado por “La Caixa”. Para Plasència es natural que en un mundo tan interconectado el estado de alerta haya trascendido al miedo incluso antes de que hubiera una amenaza real en España.

Según datos de La Vanguardia el Covid-19 despertó la alarma en España mucho antes de que se extendiera por la península. La cuarentena de Wuhan y el propósito de construir un hospital en diez días en el epicentro del brote se convirtieron en las primeras informaciones que permitieron desde la distancia medir la envergadura de la epidemia. Desde entonces al menos 250.000 usuarios entraron día tras día a seguir el avance de la epidemia en el mundo.

En la última semana la afluencia en la web se ha intensificado hasta alcanzar récords: la cifra de lectores interesados en el coronavirus triplica ya el interés suscitado por los disturbios en Barcelona por la sentencia de el procés y supera de largo los más de tres millones de usuarios que el 10-N leyeron artículos relacionados con las elecciones generales.

Para Roger Ballescà, psicólogo y Vicesecretario del Col·legi de Psicologia de Catalunya es muy natural que en estos momentos haya un estado de alarma generalizado ya que las medidas implementadas en esta última semana no tienen ningún precedente en los últimos 100 años. “La reacción de la población es incluso moderada y contenida”, añade.

El virus del miedo afecta más a personas que tienen una estructura psicológica más vulnerable

Si el coronavirus tiene efectos nocivos sobre personas con patologías previas, el virus del miedo también tiene efectos más lacerantes sobre las personas que padecen algún trastorno. “Es normal que el escenario actual incremente las angustias de las personas que tienen una estructura psicológica más vulnerable”, explica.

La incertidumbre y la conexión en tiempo real con lo ocurre tanto en España como el resto del mundo hacen muy difícil que la racionalidad se imponga a la emoción . El reto de esta globalización e interdependencia también tiene su propia lección y es que la única manera de contener el brote es que todos actuemos con responsabilidad.","covid, coronavirus, pandemia","100.0","GDELT","psicologo;psicólogo","covid;covid-19;coronavirus;cuarentena;estado de alarma"
"Consejos para lidiar con la incertidumbre personal y laboral que ocasiona la crisis del Covid - 19","lavanguardia.com","https://www.lavanguardia.com/vivo/psicologia/20200311/474087418640/coronavirus-gestionar-incertidumbre-miedo.html","2020-03-13 08:30:00+00:00","Vivimos tiempos inciertos, a nivel individual y colectivo, y eso nos desconcierta, nos angustia y, en cierta medida, nos paraliza. Quien más y quien menos está acostumbrado a llevar una vida “planificada”, tanto nivel personal como profesional. Organizamos nuestra agenda a días, semanas e incluso a meses vista. Tenemos unas rutinas que nos tranquilizan porque nos alejan del caos: los niños al cole, nosotros a la oficina, el sábado compra, el domingo excursión... A tal hora reunión con el jefe, a tal otra gimnasio, tal día comida familiar, en Semana Santa escapada a... Y ahora la propagación del coronavirus y las medidas destinadas a contenerla dinamitan toda esa organización. Es más, no sólo ponen en jaque toda la planificación que teníamos sino que prácticamente imposibilitan hacer otra.

“En mi empresa nos han mandado a casa a trabajar, y esta noche a penas he podido dormir, porque tengo que preparar la programación de mi equipo y no sé cómo plantearla: para una semana, para dos, para tres... No sé cómo organizarnos, porque no sabemos cómo va a evolucionar esta crisis ni qué va a pasar mañana”. La reflexión está extraída de una conversación informal con una vecina mientras paseábamos a los perros, pero expresa muy bien la angustia que la incertidumbre en torno a la crisis del Covid-19 ocasiona a muchas personas.

Porque no tener claro por dónde irán las cosas, no tener todo atado y planificado, sentir que hay cosas que escapan a nuestro control, nos hace sentir vulnerables. Y nos paraliza. “Teníamos planificado irnos mañana a Madrid a ver a mi hijo y a mis nietos, y la semana próxima nos íbamos con unos primos a Cantabria. Y mi hija nos había regalado entradas para el teatro en Madrid el día 26... Con las restricciones impuestas hemos suspendido el viaje, pero no sabemos si anular también los planes de las próximas semanas o esperar a ver qué pasa...” El comentario de Teresa ilustra cómo la falta de certeza, el tener nuestro futuro “en el aire”, nos hace sentirnos perdidos, nos detiene.

No tener respuestas inmediatas, tener que esperar a que algo se resuelva, nos crea ansiedad. Pero la realidad es que cuando las situaciones que creíamos controladas se convierten en imprevistos podemos angustiarnos y frustrarnos, pero también podemos adaptarnos.

Claro que aceptar lo imprevisible supone un esfuerzo psicológico para muchas personas, y por eso vale la pena atender a algunas pautas que dan los expertos para lidiar mejor con la incertidumbre.

“Lo primero que hemos de hacer es entender que la incertidumbre es una reacción normal y adaptativa ante una situación imprevista, y que tiene utilidad, que es una emoción que nos va a ayudar a poner en marcha planes de acción para reducir esa situación incierta”, dice Oscar Asorey, psicólogo de Isep Clínic Reus.

Rafael Penadés, vocal de la junta de gobierno del Col·legi Oficial de Psicologia de Catalunya (COPC), explica por qué la crisis del coronavirus nos afecta tanto y estamos todos tan preocupados. “Impacta en el área del miedo, una emoción muy básica y muy contagiosa para la genéticamente estamos predeterminados; hay una base psicofisiológica, nuestro cuerpo está preparado para actuar así, para que si percibe una señal del peligro, vaya a por todas, reaccione con el todo o nada”. Y puntualiza que en esa reacción automática el cerebro no distingue si hemos de protegernos del virus de la gripe o de una catástrofe nuclear, de modo que hemos de ser nosotros quienes mediemos en la respuesta para hacerla más racional.

En el caso de la incertidumbre, dice Penadés, además de la base fisiológica hay también un componente social y cultural. “Queremos comprar tranquilidad y no tener una herramienta que nos proporcione esa tranquilidad nos desespera, así que intentamos hacer algo para estar tranquilos y compramos mascarillas o llenamos la despensa...”

Asorey explica que la incertidumbre se alimenta con preocupaciones y pensamientos sobre hechos que no han ocurrido y tendemos a engordarla con teorías tremendistas o catastrofistas sobre el futuro. Un tremendismo en el que es fácil caer, dicen Asorey y Penadés, con la cantidad de inputs de información de alerta que recibimos.

Por eso uno de los consejos más reiterados de los psicólogos es no sobreexponerse a la información, acceder sólo a la “justa y correcta”. Es decir, acotar un tiempo concreto por la mañana o por la noche para consultar información, y sólo en fuentes fiables –el portal de la OMS, la web del ministerio de Sanidad, el portal de la Agència de Salut Pública de Barcelona o el Canal Salut de la Generalitat de Catalunya, o medios de comunicación de credibilidad contrastada–.

“Está comprobado que el tiempo de exposición a información va asociado al nivel de preocupación; la sobreexposición te crea un nivel de alerta que luego ya no puedes bajar”, remarca Penadés.

“Hemos de centrarnos en resolver lo que ocurre ahora y no tratar de resolver lo que tememos que vaya a ocurrir en el futuro;desde el presente es desde donde podemos actuar, desde donde está lo posible momento a momento”, recomienda Asorey. Y explica que no se trata de vivir el presente con una actitud contemplativa, sino de centrarnos en lo que realmente está a nuestro alcance en cada situación, en hacer cosas útiles. “El presente desangustia si nos permite pasar a la acción”, enfatiza.

Y destaca que planificar objetivos y acciones concretas, sobre todo dirigidas al autocuidado, puede mejorar nuestro sentimiento de autoeficacia y autoconfianza ante la incertidumbre.

Los psicólogos subrayan que hay que asumir el miedo y la incertidumbre, que es normal que nos preocupemos por lo que va a pasar la semana que viene o la próxima. “Pero preocuparnos no es dramatizar, y dramatizamos cuando empezamos a generar pensamientos negativos o exagerados sobre las consecuencias no deseadas que pueden llegar a venir”, dice Asorey.

“Se trata de focalizarte en lo que puedes controlar y desconectarte del resto; cada día las cosas van cambiando y es posible que el lunes estemos en otra fase, pero no sabemos si será buena o mala; podemos focalizarnos también en aspectos positivos, como ver que en China los casos van disminuyendo”, coincide el vocal del COPC. Explica que, por ejemplo, estar al día de la evolución del coronavirus en Italia no es necesario para nuestro día a día y, en cambio, crea una inseguridad y alerta que luego no puedes paliar. De ahí que su consejo sea “no ocuparte de aquello que no puedes controlar”.

Los psicólogos advierten que la planificación tiene que ser una herramienta flexible, que nos permita adaptarnos según vaya evolucionando la situación, porque si la tomamos como una forma de control puede alentar más nuestra angustia. “Se trata de crear un plan de acción en función de las circunstancias actuales, sabiendo que si mañana cambia la situación, con la experiencia de mi plan actual podré crear otro para adaptarme”, comenta el psicólogo de Isep Clínic.

Penadés, que trabaja en el servicio de Psiquiatría del Hospital Clínic de Barcelona, asegura que a menudo planificamos y tenemos la ilusión de control cuando en realidad no controlamos tanto, porque hay acontecimientos a los que tenemos que acomodarnos porque no estaban planificados. Por eso su consejo es dejarse llevar, aguantar unos días el no planificar y la incertidumbre, y si eso nos crea mucha inestabilidad o mucha tensión, pensar que es algo limitado, que no es para siempre.

“Si no tener planificación te crea inestabilidad o mucha tensión, piensa que es algo limitado, no para siempre”

“No pasa nada porque bajemos el ritmo y vayamos día a día; nos preocupa no saber si anular o no un viaje, pero no pasa nada por no poderlo saber, no es tan grave; la pandemia es global y a nadie le va a sorprender si lo anulas a última hora”, reflexiona el vocal del COPC.

Porque, explican los psicólogos, no planificar, no llevar una vida programada, no es sinónimo de caos ni de inmadurez, y la incertidumbre también ofrece la oportunidad de pensar que todo es posible.","covid, coronavirus, pandemia","70.0","GDELT","ansiedad;psicologo;psicólogo","covid;covid-19;coronavirus"
"La UE destinará 4 . 000 millones a España para hacer frente al coronavirus","elconfidencial.com","https://www.elconfidencial.com/economia/2020-03-13/union-europea-ayuda-espana-coronavirus_2497384/","2020-03-13 17:00:00+00:00","La UE destinará 4.000 millones a España para hacer frente al coronavirus

La Comisión Europea ha anunciado un paquete de inversión de 37.000 millones para hacer frente al coronavirus, de los que España recibirá algo más de 4.000 millones

El Ejecutivo comunitario lleva días haciendo cuentas para rebañar dinero de las cuentas del actual Marco Financiero Plurianual (MFP) y aprovechar el dinero que quedaba pendiente de ejecutar para ayudar a los Estados miembros a lidiar con los efectos del coronavirus. Este viernes la Comisión Europea ha anunciado un plan de inversión de hasta 37.000 millones de euros, y de ellos tiene previsto que España reciba unos 4.145 millones de euros.

Las cuentas son complejas. En principio España podría recibir 1.161 millones de euros “en cuestión de semanas”, unos millones de fondos estructurales no ejecutados que el Gobierno iba a tener que devolver a las arcas comunitarias, pero que ahora Bruselas libera para que se usen por parte de las capitales. “Era un dinero durmiente que los Estados miembros no podían usar. Ahora lo hemos activado y puede dirigirse a nuevos sectores a los que no podría destinarse en condiciones normales”, ha destacado Ursula von der Leyen, presidenta de la Comisión Europea, que ha señalado que se está “liberando dinero que no se habría usado”.

A esos primeros 1.161 millones que recibiría España habría que sumarle toda una batería de otra serie de ayudas que beberían del presupuesto de la Unión Europea y que darían a España otros 2.989 millones de euros directos de las cuentas europeas, llegando a la cifra de 4.145 millones.

Los países del este recibirán mucho más dinero que Italia, que es el país que más está sufriendo el impacto del coronavirus, porque estos fondos se van a desbloquear en proporción al reparto que estaba ya establecido para los fondos estructurales, y que premian a los países más rezagados en cuanto a desarrollo y riqueza.

Eso sí, Bruselas marca una hoja de ruta para dirigir esos fondos que ahora van a recibir los Estados miembros. Busca que con este dinero se invierta en el sistema sanitario en un momento en el que está sometido a un gran estrés, que se facilite liquidez a las pequeñas y medianas empresas más afectadas por el virus y, por último, se apoye al mercado laboral.

Para poner en marcha este paquete la Comisión Europea necesita la luz verde del Parlamento Europeo y del Consejo, ambas instituciones muy tocadas en el funcionamiento del día a día debido, precisamente, a las precauciones que se están tomando en la capital comunitaria respecto a la crisis del coronavirus.

El Ejecutivo comunitario lleva días haciendo cuentas para rebañar dinero de las cuentas del actual Marco Financiero Plurianual (MFP) y aprovechar el dinero que quedaba pendiente de ejecutar para ayudar a los Estados miembros a lidiar con los efectos del coronavirus. Este viernes la Comisión Europea ha anunciado un plan de inversión de hasta 37.000 millones de euros, y de ellos tiene previsto que España reciba unos 4.145 millones de euros.

- Las grandes empresas preparan una ola de despidos en plena crisis por el coronavirus Juan Cruz Peña

- La Agencia Tributaria ampliará el plazo de pago de impuestos por la crisis del Covid-19 Javier G. Jorrín

- En siete días, España llegará a la situación en que Italia puso todo el país en cuarentena Enrique Andrés Pretel Antonio Villarreal Gráficos: Jesús Escudero","covid, coronavirus, pandemia","100.0","GDELT","estres;estrés","covid;covid-19;coronavirus;cuarentena"
"Salvar a quien pueda sobrevivir : quién tiene prioridad , según la SIAARTI italiana","elconfidencial.com","https://www.elconfidencial.com/mundo/2020-03-13/coronavirus-italia-siaarti-cuidados-intensivos-uci_2494779/","2020-03-13 05:00:00+00:00","En un documento de siete páginas, la sociedad de terapia intensiva propone diversos estándares de acceso al tratamiento en casos de escasez de recursos médicos

El aumento del número de casos de coronavirus en Italia está llevando a los profesionales médicos a tomar decisiones críticas en muy poco tiempo, a menudo con una gran carga moral. En este momento, hay más de 12.000 casos diagnosticados y más de 800 muertos. Las UCI de los hospitales están llenas y no disponen de respiradores suficientes, por lo que no todo el mundo puede ser tratado en las mismas condiciones. La gran pregunta que todo el mundo se hace es ¿quién sí y quién no?

Ante dicha situación, la SIIARTI (Sociedad Italiana de Anestesia, Analgesia, Reanimación y Terapia Intensiva) publicó el pasado sábado un documento con sus recomendaciones para los facultativos italianos en una situación excepcional que comparan con una campaña bélica. El título lo dice todo. “Recomendaciones de ética clínica para la admisión y suspensión de tratamientos intensivos en condiciones excepcionales de desajustes entre necesidades y recursos disponibles”.

Se deben garantizar tratamientos intensivos a pacientes con mayores posibilidades de éxito; se trata de privilegiar la ‘mayor esperanza de vida’

“Nos encontramos en un escenario en el que pueden ser necesarios criterios para el acceso (y el alta) en los cuidados intensivos, no solamente a partir de la adecuación clínica y la proporcionalidad de la atención sino atendiendo a un criterio de justicia distributiva y aplicación apropiada de los recursos sanitarios limitados”, señala la introducción de las siete páginas del documento, que traza un plan para las próximas semanas. “Un escenario de este tipo es asimilable a la conocida como ‘medicina de la catástrofe’, para la cual la reflexión ética ha desarrollado a lo largo del tiempo indicaciones para médicos y enfermeros en situaciones difíciles”.

El criterio a atender en un contexto crítico de asignación de recursos, explica, es el de “garantizar tratamientos intensivos a pacientes con mayores posibilidades de éxito terapéutico; por lo tanto, se trata de privilegiar la ‘mayor esperanza de vida”. El acceso a cuidados intensivos debe tener en cuenta otros factores como tipo y gravedad de la enfermedad, presencia de comorbilidades, deterioro de otros sistemas y reversibilidad.

Lo que no tiene sentido en una situación así, prosigue el documento de la sociedad, es seguir el principio de “por orden de llegada”, ya que “equivaldría a elegir no tratar a ninguno de los pacientes que llegasen más tarde, que serían excluidos inmediatamente de los cuidados intensivos”.

El documento de la asociación vio la luz al mismo tiempo que el reanimador anestesiólogo Christian Salaroli explicaba a ‘Il Corriere de la Sera’ que en el hospital Papa Giovanni XXIII, de Bérgamo, ya se estaba decidiendo a quién tratar “con base en la edad y en las condiciones de salud”. “Como en todas las situaciones de guerra”, añadía.

El texto propone una serie de patrones a aplicar a la hora de admitir a unos pacientes u otros, teniendo en cuenta que la reducción de plazas en las unidades de cuidados intensivos no solo perjudicaría a los pacientes de la presente enfermedad sino que también haría aumentar la morbilidad entre “las condiciones clínicas no vinculadas a la enfermedad en curso, debido a la reducción de la actividad quirúrgica y ambulatoria y la escasez de recursos”. Los principios se aplican a todos, ya sean pacientes de Covid-19 o no.

Se trata de reservar recursos escasos para aquellos que tienen más probabilidades de supervivencia y esperanza de vida

“Puede llegar a ser necesario establecer un límite de edad para ingresar en la UCI”, señala la SIIARTI. “No se trata de decisiones únicamente valorativas, sino de reservar recursos que podrían ser escasos para aquellos que tienen más probabilidades de supervivencia y, además, a aquellos que pueden tener más años de esperanza de vida, con el objetivo de maximizar los beneficios para la mayoría de personas”.

Otros factores son la comorbilidad (presencia de otros trastornos) entre los pacientes y su estado funcional. ""Es posible que un desarrollo relativamente corto entre las personas sanas sea potencialmente más largo y, por lo tanto, consuma más recursos ['resource consuming'] en el caso de los pacientes ancianos, frágiles o con una severa comorbilidad"".

Caben otras posibilidades. Por ejemplo, la expresión manifiesta de la voluntad de los pacientes de no recibir tratamiento o un tratamiento limitado a través de un testamento vital (DAT, en Italia) que estipule una planificación compartida del tratamiento. El informe también recuerda que aquellos pacientes que no accedan a un tratamiento intensivo no deben ver perjudicadas otras atenciones de menor nivel. Además, deben ser “comunicados, explicados y documentados”.

“Los criterios de acceso a cuidados intensivos deben ser discutidos y definidos para cada paciente de la manera más temprana posible, si es posible creando a tiempo una lista de pacientes que serán considerados como necesitados de cuidados intensivos en el momento en que ocurrió el deterioro clínico, siempre que la disponibilidad de ese momento lo permita”, señala el documento. “Cualquier instrucción de ‘no intubar’ debe estar presente en el registro médico, listo para ser utilizado como guía si el deterioro clínico se produce precipitadamente y en presencia de cuidadores que no han participado en la planificación y que no conocen al paciente”.

Uno de los objetivos de esta clase de guías es librar a los facultativos, en un momento de extremo estrés, de la toma de decisiones morales que harían imposible lidiar con la situación de forma eficiente. Como recalca el texto, el objetivo es “aliviar a los médicos de una parte de la responsabilidad en sus elecciones, que pueden ser emocionalmente costosas si han de ir caso por caso”.

Es previsible que la necesidad de tomar esas decisiones repetidamente hará que el proceso de toma de decisiones sea más sólido

“La decisión de limitar los cuidados intensivos debe discutirse y compartirse de la manera más colegiada posible por el equipo tratante y, en la medida de lo posible, en diálogo con el paciente (y los miembros de la familia), pero debe ser oportuna”, explica el texto. “Es previsible que la necesidad de tomar esas decisiones repetidamente hará que el proceso de toma de decisiones sea más sólido y se adapte mejor a la disponibilidad de recursos”.

Si en el proceso de toma de decisiones surgen situaciones de “dificultad e incertidumbre particulares”, se debe contar con una segunda opinión de otros organismos. En el caso propuesto por la SIIARTI, los Centros Regionales de Coordinación. La asociación también aboga por una sedación paliativa entre pacientes hipóxicos con un avanzado estado de la enfermedad como “muestra de una buena práctica médica”. “Si el periodo agónico no es breve, debe realizarse una transferencia a un ambiente no intensivo”.

El aumento del número de casos de coronavirus en Italia está llevando a los profesionales médicos a tomar decisiones críticas en muy poco tiempo, a menudo con una gran carga moral. En este momento, hay más de 12.000 casos diagnosticados y más de 800 muertos. Las UCI de los hospitales están llenas y no disponen de respiradores suficientes, por lo que no todo el mundo puede ser tratado en las mismas condiciones. La gran pregunta que todo el mundo se hace es ¿quién sí y quién no?

- España supera los 3.000 casos y ya registra 84 fallecidos en la crisis de coronavirus El Confidencial

- Descontrolado el brote en el 'geriátrico del coronavirus': la mitad están infectados Alfredo Pascual

- No te creas estos audios de WhatsApp que siembran el pánico sobre el coronavirus Manuel Ángel Méndez","covid, coronavirus, pandemia","30.0","GDELT","estres;estrés;terapia","covid;covid-19;coronavirus"
