title,newspaper,url,published_at,plain_text,keyword,relevance_score,source,mh_matches,covid_matches
"La nueva polarización , por John Carlin",lavanguardia.com,https://www.lavanguardia.com/opinion/20201011/483988036537/trump-biden-estados-unidos-casa-blanca-polarizacion.html,2020-10-11 02:45:00+00:00,"Habría una cierta coherencia en que Donald Trump ganase las elecciones del 3 de noviembre. Cuatro años más de Trump en el manicomio en el que ha convertido la Casa Blanca entonaría con los tiempos locos que vivimos.

Entre el pandemonio babélico de las redes sociales, el reino de la posverdad (o el triunfo de la mentira), la sorda irrealidad en la que ha caído el fútbol y, por supuesto, el caos y la confusión que sigue sembrando el coronavirus, la polémica creciente sobre cómo combatir la catástrofe sanitaria y la catástrofe económica… entre tanto lío, ante semejante panorama, más apropiado sería tener a un hombre-bebé, a un buey naranja, a un ignorante histérico como líder de lo que una vez llamábamos “el mundo libre” que a un señor maduro, sereno y gris como Joseph Biden.

Veamos primero el fútbol, más consuelo y más refugio para más gente que cualquier otra religión. Ahora que solo podemos ver los partidos en televisión, los estadios se han convertido en pueblos Potemkin, pixelados para engañarnos de que están llenos. A esto se suman los sonidos falsos (generados por un técnico que hace lo que puede, pobre) de aficionados cantando o celebrando goles.

¡Y después están los resultados! ¿Vieron lo que pasó en la Premier, la Liga favorita del mundo, el domingo pasado? La anarquía. El Liverpool, campeón inglés y reciente campeón de Europa, perdió 7 a 2 contra el Aston Villa, que se salvó del descenso por un punto la temporada pasada. El Manchester United, derrotado 6-1 en casa (concepto ya irrelevante) contra el Tottenham.

No me digan que estas locuras futboleras no son otro síntoma del virus, a su vez una metáfora de cómo Facebook, Twitter, Instagram y tal han invadido, capturado y envenenado las mentes de media humanidad. El documental Dilema social de Netflix ofrece un demoledor testimonio de cómo los amos de las redes sociales se enriquecen a base de polarizar e idiotizar a los miles de millones de adictos que componen su clientela. El director del documental, aterrado, aconseja a la gente que abandone las redes sociales ya. Yo lo hice hace tiempo, pero sospecho que pocos seguirán mi ejemplo o el del director. Es un problema para el mundo, pero para mí también. No participo en la nueva normalidad tuitonta , con lo cual acabaré yo siendo el anormal, es decir, el loco. Pero sigamos.

La posverdad, hija de las redes sociales. Trump dio la nota de cómo iba a ser su presidencia (22.000 mentiras contabilizadas por The Washington Post en menos de cuatro años) cuando lanzó un tuit el día de su toma de posesión, en enero del 2017, declarando que una multitud “récord” había acudido al acto. Las fotos aéreas demostraron que muchísima más gente había celebrado la investidura de Barack Obama, pero a Trump ni se le pasó por la cabeza rectificar. Ni a sus fieles, el 40% del electorado estadounidense. Para ellos todo lo que dice Trump va a misa. Vemos algo parecido en el sacerdocio científico.

En el mundo político de Estados Unidos coexisten dos mundos paralelos, cada uno con su verdad. Aunque hablemos de datos concretos, de números, no se ponen de acuerdo. La ciencia tampoco se pone de acuerdo respecto al coronavirus. No lo he visto tanto aquí en España, aunque se detecta una tendencia creciente, pero en el mundo científico anglosajón la polarización sobre cómo responder a la pandemia se vuelve cada día más agria.

Esta semana 6.500 científicos y médicos, la mayoría de Estados Unidos y el Reino Unido, firmaron una declaración en la que criticaron duramente la ortodoxia del confinamiento y la distancia social. La idea básica que proponen es que hay que aprender a convivir con la Covid-19 poniendo todos los recursos al servicio de los más vulnerables y a la vez dejando que la mayoría que no corre el riesgo de morir del virus siga con sus vidas según la vieja normalidad. El deseado fin es llegar cuanto antes a la famosa “inmunidad de rebaño”.

“Mantener las medidas de confinamiento hasta que una vacuna esté disponible causará un daño irreparable que afectará de manera desproporcionada a los menos privilegiados”, dice la declaración. “Las actuales políticas de confinamiento están produciendo efectos devastadores en la salud pública a corto y largo plazo. Los resultados incluyen un reducido índice de vacunación para niños, más enfermedades cardiovasculares, menos detecciones del cáncer y un deterioro en la salud mental, lo que conducirá a un mayor exceso de mortalidad en el futuro, con la clase trabajadora y los más jóvenes condenados a cargar con la mayor parte del peso”.

Naturalmente ha caído una tormenta sobre los firmantes de la declaración. Virólogos y epidemiólogos del bando institucional, los proveedores de la ciencia en la que se basa la mayoría de los gobiernos, han estado haciendo cola para denunciar su irresponsabilidad y su desconocimiento del virus, argumentando que si se implementan sus propuestas cientos de miles más morirán.

El problema es que la ciencia aún no existe sobre la manera más eficaz de luchar a la vez contra el virus, las enfermedades colaterales que fomenta y la pobreza. Con lo cual podemos pronosticar que la grieta que divide a ambos bandos se va a extender a la población general, que en los próximos meses la nueva polarización respecto a qué hacer con el maldito bicho será un reflejo de la polarización que hemos visto con el trumpismo, el Brexit, la independencia catalana y con la rivalidad Barça-Madrid.

Cada uno elegirá su bando según en parte su temperamento, en parte su experiencia personal. Conozco a un joven inglés que obtuvo un título en Ingeniería Mecánica en una buena universidad hace 15 meses. Desde entonces solo ha podido conseguir trabajo en bares, y últimamente ni siquiera. Sé en qué bando se posicionará él. Conozco el caso de una mujer que se murió de cáncer la semana pasada tras no haber podido acudir en abril a una cita que tenía programada para ver cómo evolucionaba su enfermedad. Sé cómo pensarán sus familiares, al revés, se supone, de aquellos cuyos padres o abuelos se han muerto del virus, de aquellos que tienen más motivo para pensar que morirán si se contagian, de aquellos que no temen por cómo van a dar de comer a sus hijos o de aquellos que son sencillamente más prudentes, que están menos en paz con los riesgos que depara la vida.

Con lo cual, como ya vemos en Madrid, griterío general garantizado. Bienvenidos al mundo Trump, a los tiempos que nos ha tocado vivir. Habrá más conflicto, más histeria y más locura. Mientras, Facebook, Twitter y compañía ahí seguirán, ganando dinero, haciendo lo que la tecnología permite para manipular, incitar y enredar al mundo entero.","covid, coronavirus, pandemia",30.0,GDELT,salud mental,covid;covid-19;coronavirus;pandemia;confinamiento
Rastreadores de covid | Y ahora la economía . La marca España está en caída libre,elconfidencial.com,https://www.elconfidencial.com/mundo/2020-10-11/rastreadores-de-covid-y-ahora-la-economia-la-marca-espana-esta-en-caida-libre_2785215/,2020-10-11 18:15:00+00:00,"'Rastreadores de covid' | Y ahora la economía. La marca España está en caída libre

Pablo Pombo se sumerge en la prensa internacional y selecciona los artículos imprescindibles para estar bien informado sobre la pandemia. Una 'newsletter' diaria solo para suscriptores

Primero fue el descontrol sanitario y luego la toxicidad política. Ahora es la economía. Lo es cada vez más. Preocupación. La marca España está en caída libre, cayendo a “país paria” a ojos de los inversores. No es que haya consenso, hay unanimidad. Las principales cabeceras del mundo están empleando palabras muy duras para informar de lo que ocurre aquí.

Caos. Peor desempeño. Niño problemático. Andarse con cuidado. Desempleo por encima del 20%. Lista de riesgos. Obstáculos serios. Falta de impulso reformista. Tensión. Rebaja de calificación. Vodevil. Sin presupuestos desde hace años. Desorden. Depresión más profunda… Harán falta años y no pocos para que España pueda recuperar en el mundo todo lo que viene perdiendo en los últimos meses.

España: el eslabón débil de Europa. Duro título y tremendo texto sobre nuestro país en el 'Wall Street Journal'. “España, en la economía europea, fue una estrella en ascenso. Sin embargo está en camino de convertirse en el niño problemático. El último ejemplo de porqué los inversores globales tendrían que andarse con cuidado en los mercados del sur europeo […]

Entre los países desarrollados, España parece tener un problema especial […] Su desempeño es peor que el de todos sus pares europeos, incluida Italia […] No ha podido contener el virus. En primavera el gobierno tardó en actuar, para activar después el más estricto de los confinamientos […] Intentó volver a la normalidad demasiado rápido […] Las tasas de infección se dispararon en verano, con España en un tercio de todos los casos europeos […] Ahora Madrid es una de las ciudades más afectadas y se han promulgado nuevas medidas que impactan directamente en el sector servicios […]

Es probable que la tasa de empleo real esté muy por encima del 20%, en lugar del 15% oficial […] Es probable que la brecha económica con las naciones más ricas se amplíe a partir de ahora […] Los fondos europeos probablemente llegarán demasiado tarde y no solucionarán la dependencia excesiva que tiene España de industrias relativamente improductivas como el turismo”.

Preocupación por la economía española. “Es España, no Italia, lo que preocupa a los inversores europeos”. De nuevo lo mismo, título severo y texto que oscurece el horizonte entero. Esta vez en 'Bloomberg'. “La creciente lista de riesgos de España está empezando a poner nerviosos a los inversores […] Citigroup Inc. ha recomendado vender fondos españoles frente a sus pares portugueses, subrayando crecientes inquietudes fiscales, aumento de las tensiones separatistas en Cataluña y la perspectiva de una rebaja de calificación crediticia después de que S&P Global ratings redujera la perspectiva nacional a negativa […] Por otro lado, el indicador bursátil de referencia del país es, con mucho, el de peor desempeño europeo en este año […]

Tras el resurgimiento del virus, temores de que la depresión económica de esa nación sea más profunda que la del resto de Europa […] Se espera que España recupere la producción perdida únicamente en 2024, la última entre las 10 economías más grandes de la zona del euro, escribió el estratega de Citi Aman Bansal. ""Esto pone de relieve la falta de impulso reformista, sin que se haya aprobado ningún presupuesto desde 2018 bajo el gobierno de minoría de centro izquierda"".

Faltan presupuestos y falta coordinación. Ni una palabra sobre James Rhodes en la información del 'Financial Times' sobre el plan Sánchez. Bastante atención a las advertencias del Banco de España, por ejemplo esta: “Si hacemos un mal uso de los fondos, y se utilizan básicamente para gasto corriente, el efecto multiplicador se reducirá mucho”.

Y notable énfasis en los Presupuestos Generales de 2021. “A pesar de llevar dos años en el poder, Sánchez aún tiene que aprobar un presupuesto propio, en lugar de apoyarse en los planes expansivos de sus predecesores. Dirigentes de su gobierno reconocen que el problema es casi una lucha existencial porque aprobar un presupuesto podría asegurar la coalición minoritaria de Sánchez durante dos o tres años”.

Otro artículo del mismo medio: “El desorden de Madrid contrasta con París y Bruselas […] La tensión entre el gobierno regional y el gobierno nacional viene complicando la respuesta a la pandemia desde que estalló el pasado mes de marzo”.

Ojo. La ayuda europea puede retrasarse. “La recuperación económica de Europa se ha convertido en un sueño de verano”. 'New York Times'. “Las débiles esperanzas que quedaban han desaparecido a medida que el virus volvía a propagarse […] El otoño ha hecho ver que quedan obstáculos serios para que el fondo de ayuda de la Unión Europea pueda llegar a administrarse, limitando las perspectivas de los países más afectados como Italia y España.

Sánchez anunció el miércoles un plan de estímulo por valor de 72,000 millones de Euros, con cuatro quintas partes del dinero procedentes del fondo europeo. Es probable que España tenga que esperar a tener ese dinero. Se supone que estará operativo en enero. Pero es casi seguro que habrá retrasos según los estados miembros debatan las condiciones de su distribución, fundamentalmente por las reglas destinadas a obligar a Hungría y Polonia a cumplir con el marco democrático del bloque.”

La batalla política está sembrando el caos. La evolución del pulso entre Sánchez y Ayuso fue seguida por las principales cabeceras mundiales. Asombro generalizado y hasta lástima. El tono de las siguientes palabras en 'Le monde' representa el juicio general de una semana que ha sido devastadora para la marca España.

“Si. No. Puede ser. Bajo la mirada cada vez más incrédula y desconcertada de los madrileños, el vodevil de la caótica gestión de la pandemia covid-19 en la capital española experimentó un nuevo vuelco el jueves. Seis días después de decretado el cierre de la ciudad […] fue anulado por el Tribunal Superior de Justicia de Madrid. […] Epicentro de la segunda ola pandémica, la capital se ha convertido también en escenario de una encarnizada batalla política entre el gobierno español y la Comunidad de Madrid”.

Primero fue el descontrol sanitario y luego la toxicidad política. Ahora es la economía. Lo es cada vez más. Preocupación. La marca España está en caída libre, cayendo a “país paria” a ojos de los inversores. No es que haya consenso, hay unanimidad. Las principales cabeceras del mundo están empleando palabras muy duras para informar de lo que ocurre aquí.","covid, coronavirus, pandemia",100.0,GDELT,depresion;depresión,covid;pandemia
"Confinar o no confinar , ésa no es la cuestión",eldiario.es,https://www.eldiario.es/opinionsocios/confinar-no-confinar-no-cuestion_132_6286464.html,2020-10-12 15:00:00+00:00,"A lo largo de estas últimas semanas hemos visto cómo ha ido en aumento la tensión entre diferentes administraciones. La discusión política se ha centrado en torno a un debate común: ¿qué nivel de confinamiento es mejor para que la economía no caiga? Pero no sólo se ha dado esta disyuntiva entre los políticos, el debate estaba también en la calle. Hay quienes abogan por unas fuertes medidas restrictivas para detener al virus y quienes, por el contrario, denuncian que los confinamientos no van a traer más que la ruina económica.

Entre tanto, surgen voces que nos alertan del aumento de ansiedad y trastornos psicológicos en la infancia a causa de los confinamientos y de la forma de gestionar esta crisis. Y lo mismo sucede con nuestros mayores, que en muchos casos vislumbran la posibilidad de un final en aislamiento, lejos de los suyos o, en todo caso, con demasiadas restricciones para mantener unas relaciones saludables con sus familiares o amistades cercanas.

El virus sigue ahí. Eso es evidente. Como también lo es el riesgo que representa, sobre todo para las personas cuyas vidas son más vulnerables, o como dicen algunos, se han visto más vulneradas por razones de edad, salud, situación económica o social. Y estos riesgos vienen acompañados de unos miedos lógicos. Miedo a morir, a las secuelas de la enfermedad, a perder el empleo, un ser querido...

Por eso, hay quienes aceptan con alivio cualquier medida que ofrezca un mínimo de seguridad ante tales miedos. Y por la misma razón tienen la necesidad de tener bajo control cualquiera de los escenarios donde nos movemos: el trabajo, el transporte público, el supermercado, la terraza de un bar, la calle, los parques, la comunidad de vecinos... Y entonces ven conductas de riesgo por todos lados. Y tienen la impresión de que todo el mundo lo hace mal. Y están convencidos de que la única manera de acabar con estos miedos es prohibir cualquier situación de riesgo, pese a quien pese. Controlar cada espacio de nuestras vidas que se ven afectados por terceros es sencillamente imposible, y se deriva en un aumento constante de la ansiedad. Vivir así es insostenible.

En la otra cara de la moneda los hay que parecen ponerse la mascarilla en los ojos y negar las evidencias. Para quienes parece que la economía es lo único, y que cualquier medida que trate de acabar con el virus la pone en riesgo. Y puede que también tengan razón en sus planteamientos, pero lo llamativo es que los políticos que lo afirman tampoco han propuesto soluciones más allá de la famosa “responsabilidad individual”. En su defensa alegan que no hay dinero. No hay dinero para rastreadores, ni para sanitarios, ni para docentes, ni para trabajadores ni educadores sociales... En definitiva, nos piden que nos arriesguemos, que hagamos renuncias, aunque esta vez ya no seamos héroes ni heroínas a los que aplaudir. También insinúan que si enfermamos la culpa será nuestra, por lo que no tendrán responsabilidad alguna con nuestra salud. Me pregunto si esa responsabilidad individual es tan sencillo tenerla cuando tienes quince años y una vida por delante, o si vives en una infravivienda compartida con más de seis personas, o si tienes que atravesar todos los días la ciudad en vagones atestados, o si tienes miedo de ser despedido si contraes la enfermedad, si vives en un barrio con calles estrechas colonizadas por los coches, o si simplemente sufres un trastorno mental y no tienes a nadie que te ayude a comprender lo que se te pide... No todo se puede cargar en la mochila de la responsabilidad individual.

En estos días vemos a colectivos salir a la calle, pidiendo ayuda económica por el futuro incierto de sus negocios, y al mismo tiempo, a jóvenes que se saltan las normas y acuden a fiestas masivas. Nuestra sociedad se ha construido en las últimas décadas sobre dos cimientos básicos: el crecimiento económico y la libertad individual. Y el virus ataca precisamente a estos dos pilares. Por ello, estamos recibiendo mensajes tan contradictorios como: consume, pero no vayas a los bares; la cultura (el cine, el teatro, los conciertos...) y el transporte son seguros, pero los espacios cerrados o abarrotados de gente son peligrosos; puedes servir copas en un bar, pero no tomarlas; mantén la distancia de seguridad, salvo en los colegios en los que es suficiente la mascarilla (incluso en la hora del almuerzo); haz actividades al aire libre, pero no en los parques que se van a cerrar para evitar botellones; los mayores riesgos de contagio se dan en las reuniones familiares, pero no en las laborales... Todo esto sólo lleva a un lugar: la esquizofrenia colectiva.

Sí, en estos tiempos corremos riesgos. Sanitarios, pero no sólo por contraer Covid, sino por nuestra salud mental, de la que tan poco se habla. También corremos riesgos sociales y económicos. El ocio empieza a estar mal visto. Hemos disfrutado de las vacaciones, pero para que la economía sobreviva, no porque merezcamos el descanso. Por un lado, no podemos luchar contra el virus y, por otro, no podemos encerrar a todo el mundo porque la economía se vendría abajo.

El virus pone en riesgo los derechos alcanzados. Pone en riesgo nuestra salud y nuestra cartera.

En marzo el confinamiento fue la salida fácil frente a un virus que apenas conocíamos y que atacaba con una rapidez pasmosa. Sin embargo, ahora sabemos muchas más cosas. Como que hay menor riesgo de contagio en espacios abiertos o que la mascarilla actúa como barrera y que la mezcla de la distancia de seguridad combinada con la mascarilla y los geles son el mejor protector... Por eso creo que ya no hay excusa para no enfocar bien el problema. No creo que la solución pase por limitar aún más nuestras necesidades y derechos, sino de crear las condiciones para que todo el mundo se sienta seguro haciendo lo que hacía antes de la pandemia, protegiendo las vidas más vulnerables. Y para ello es imprescindible prestar especial atención a nuestras necesidades, las de todos, y no tanto a las acciones concretas. Me explico. Los niños y niñas necesitan socializar, jugar con sus amigos, pero deberán hacerlo con la seguridad de no contagiarse y llevarlo después a casa. ¿Hemos cerrado por ello las escuelas? Al contrario. Los colegios son un claro ejemplo de lo que digo. Lo que durante el verano nos parecía imposible, ahora se ha convertido en una realidad. Aún hay mucho que mejorar, por supuesto, (como que bajen más las ratios, se garantice la formación a todo el mundo por igual y se usen más los espacios abiertos) pero en términos generales, los docentes han hecho un gran esfuerzo para crear entornos seguros donde los niños y niñas puedan aprender y disfrutar de sus amistades.

Necesitamos dinero para crear las condiciones individuales necesarias para una vida digna, y por ello, es necesario un empleo. ¿Se han cerrado las empresas vulnerando esta necesidad? Muchas se han esforzado por crear entornos seguros. Y las que se han visto obligadas a cerrar ha sido precisamente por la falta de apoyo y las medidas que han alejado a los clientes, como es el caso de la hostelería. ¿Es un entorno de riesgo un restaurante? Según los datos que aportan los científicos, depende. En el interior, el riesgo de transmisión por aerosoles, es elevado. Y en el exterior, si no hay distancias de seguridad entre los clientes, también. ¿La solución es cerrar los bares y restaurantes o decirle a la gente que no vaya? Puede, pero tal vez lo más sensato sería, más allá de culpas y señalamientos, buscar las fórmulas para que la gente pueda seguir disfrutando de su necesidad de ocio con la seguridad de no infectarse: mesas al aire libre, manteniendo la distancia de seguridad, desinfección entre cliente y cliente...

¿Y qué corre con el ocio nocturno? ¿Les vamos a seguir pidiendo a los jóvenes que renuncien a su juventud mientras dure la pandemia o vamos a garantizarles que se comporten como nosotros lo hicimos a su edad en un entorno seguro? Esta semana hemos conocido la noticia de una sala que va a hacer test a los mil asistentes a un concierto que se va a realizar próximamente. Deberán dar negativo y acudir con mascarilla, así como usar gel desinfectante. ¿No se vislumbra aquí una posible solución para quienes deseen disfrutar del ocio nocturno?

Me imagino lo doloroso que será para nuestros mayores ver cómo se les escapan sus últimos años de vida sin poder viajar, sin ver a sus nietos o a sus hijos, sin poder juntarse con los amigos y amigas con los que se juntaban cada día en el barrio, en el centro de día o lo que fuera. ¿Es de recibo pedirles que renuncien a todo esto por su supuesta seguridad y la de todos? ¿No vamos a ser capaces de encontrar la forma de que sigan disfrutando de los placeres más esenciales de la vida? Me resigno a pensar aquello de “es lo que hay”. No se lo merecen, ni nosotros tampoco. No podemos seguir aislándolos.

¿Y qué ocurre con nuestra necesidad intelectual? ¿Qué ocurre con el mundo de la cultura? En la ciudad donde vivo, Parla, llevábamos más de una década sin cines. Y, después de años demandando unas salas donde poder ir a ver una película, el año pasado se inauguraron al fin. No sé si sobrevivirán a esta crisis y volveremos a sufrir otra década sin cine en nuestra ciudad. Pero, volviendo al tema, ¿son inseguros los cines? Ciertamente son espacios cerrados, pero no menos amplios que un aula o un vagón de tren. Tal vez si se prohibiera comer dentro y nos aseguráramos de que todo el mundo llevara mascarillas y cumpliese con la distancia de seguridad en grupos no convivientes, eliminaríamos los factores de riesgo y todo el mundo podría ir al cine y en Parla seguiríamos disfrutando muchos años más de unas fantásticas películas.

En definitiva, puede que no dispongamos de todo el dinero del mundo para transformar nuestra sociedad de la noche a la mañana, aunque no por ello debamos renunciar a hacer de nuestro mundo un lugar mejor; y puede que las medidas restrictivas nos lleven a un pozo de oscuridad económica de la que nos resulte complicado salir; así que, ¿por qué no cambiar la perspectiva y en lugar de prohibir, juzgar, señalar, culpar, estigmatizar... nos dedicamos a ver cómo continuar lo mejor posible con nuestras vidas afrontando de una vez que este virus va a estar mucho tiempo con nosotros, buscando soluciones creativas en base a los conocimientos de los que ya disponemos sin limitarnos aún más y resolviendo el problema de la seguridad sin renunciar a nuestros derechos?

En este blog publicamos los artículos y cartas más interesantes y relevantes que nos envíen nuestros socios. Si eres socio/a puedes enviar tu opinión desde aquí. Consulta nuestras normas y recomendaciones para participar.","covid, coronavirus, pandemia",30.0,GDELT,salud mental;ansiedad;trastorno mental,covid;pandemia;confinamiento
