"title","newspaper","url","published_at","plain_text","keyword","relevance_score","source","mh_matches","covid_matches"
"Los beneficios de limpiar la casa para la salud mental y física","elconfidencial.com","https://www.elconfidencial.com/alma-corazon-vida/2020-03-17/limpieza-hogar-social-salud-mental-fisica_2500407/","2020-03-17 09:45:00+00:00","Si padeces de estrés o de ansiedad, diversos estudios confirman que una de las mejores formas de combatir estos trastornos es agarrar el trapo y eliminar el polvo de la casa

En esta época que debemos pasar recluidos en el hogar para frenar el contagio del coronavirus, nuestra relación con el tiempo ha cambiado. Si antes no disponíamos apenas de él debido a las rutinas y las responsabilidades, ahora mismo nos sobra demasiado. Esta cuarentena puede deparar para muchas personas algunos trastornos mentales relacionados con la ansiedad o la depresión; por ello, es de vital importancia mantenernos entrentenidos y cuidar nuestra salud mental.

La limpieza del hogar es una de las mejores actividades para pasar el día en casa, y no solo eso, sino también para protegernos de un posible contagio indeseado. De igual modo, tampoco conviene realizar esta tarea en exceso a riesgo de obsesionarnos y caer en una espiral de paranoia mental por la cual creas que el entorno doméstico nunca deja de estar limpio del todo.

Si dedicas veinte minutos a ordenar tu casa puedes reducir considerablemente los síntomas de ansiedad o depresión

En todo caso, lo más importante es asumir una serie de rutinas de limpieza de las diferentes partes de la casa para así habitar en mayor paz y armonía, así como facilitar la convivencia con todos aquellos con los que tengas que pasar estos días. No solo el hecho de mantener todo ordenado y limpio ayuda a tener la mente más despejada, sino también el proceso. Diversos estudios académicos elogian la capacidad de esta serie de tareas para mejorar la salud mental.

La Universidad de California, por ejemplo, reunió a treinta parejas para analizar su nivel de hormonas según el estado actual de su hogar. Así, aquellos que vivían en entornos sucios y caóticos reportaron un mayor índice de cortisol, la hormona que liberan nuestras glándulas como respuesta al estrés. Para más inri, la investigación descubrió que las mujeres se vevían más afectadas por este desorden que los hombres.

Los científicos descubrieron que un entorno limpio y ordenado se relacionaba con una alta probabilidad de salir a hacer ejercicio físico regularmente

Otro estudio, publicado en el 'British Journal of Sports Magazine', demostró que tan solo con veinte minutos de ejercicio físico empleada en tareas del hogar, ya era suficiente para reducir los niveles de estrés. Unos resultados que concuerdan con otra encuesta de un órgano de salud escocés el cual reflejo que 3.000 personas de las que fueron consultadas reconocían que la limpieza doméstica era una de sus actividades preferidas para reducir la ansiedad.

""Si dedicas veinte minutos a ordenar tu casa puedes reducir considerablemente los síntomas de ansiedad o depresión"", aseguran desde la revista 'The Way Pointe', que se ha hecho eco de estos estudios. ""Algunas de las tareas que requieren más esfuerzo, como por ejemplo fregar suelos manualmente, puede implicar dejar atrás los pensamientos negativos gracias a las calorías que quemas en el proceso"". Evidentemente, si te pasas tumbado la mayor parte del día, es mayor el riesgo de padecer episodios de ansiedad, ya que el cuerpo necesita estar activo y moverse.

En este sentido, no solo favorece a una mejor salud mental, también física. Otra investigación de la Universidad del Departamento de Actividad Física de Indiana monitorizó el impacto que tiene una casa limpia en el estado mental de un grupo de personas durante unos días. De esta forma, los científicos descubrieron que un entorno personal limpio y ordenado se relacionaba con una alta probabilidad de salir a hacer ejercicio físico regularmente. En estos días de cuarentena, se puede aplicar a los entrenamientos pensados para realizar sin salir de casa.

Otro de los beneficios de mantener la casa limpia es que habrá menos motas de polvo en suspensión en el aire, lo que te protegerá de agentes tóxicos que puedan invadir tu organismo, así como mejorará tus condiciones vitales si padeces algún tipo de enfermedad respiratoria o asma. Por ello, en estos tiempos tan inciertos en los que no sabemos cuándo volveremos a recuperar nuestra vida de entonces, dedica el tiempo a reordenar y limpiar tu casa; al fin y al cabo disfrutar de ese pequeño espacio vital en el cual vivimos y que en situaciones normales apenas estamos más que para dormir: tu salud, física y mental, te lo agradecerá,

En esta época que debemos pasar recluidos en el hogar para frenar el contagio del coronavirus, nuestra relación con el tiempo ha cambiado. Si antes no disponíamos apenas de él debido a las rutinas y las responsabilidades, ahora mismo nos sobra demasiado. Esta cuarentena puede deparar para muchas personas algunos trastornos mentales relacionados con la ansiedad o la depresión; por ello, es de vital importancia mantenernos entrentenidos y cuidar nuestra salud mental.","covid, coronavirus, pandemia","20.0","GDELT","salud mental;ansiedad;depresion;depresión;estres;estrés","coronavirus;cuarentena"
"El Colegio de Psicología de Tenerife ofrece atención gratuita a los ciudadanos","eldiario.es","https://www.eldiario.es/canariasahora/tenerifeahora/sociedad/Colegio-Psicologia-Tenerife-atencion-ciudadanos_0_1007199616.html","2020-03-18 12:15:00+00:00","El Colegio Oficial de Psicología de Santa Cruz de Tenerife ha puesto en marcha un servicio gratuito de atención psicológica para las personas que puedan necesitar apoyo en las circunstancias que marca la epidemia de COVID-19, y en particular por las posibles dificultades de tipo emocional por el confinamiento en las viviendas.

El servicio se activa mediante el envío de un mensaje de Whatsapp al 660 685757, o al correo electrónico copsctenerife@cop.es, desde donde se derivarán los casos a los psicólogos voluntarios.

El servicio se ha pensado para atender de manera prioritaria a personas mayores, enfermas o con situaciones especiales en su entorno.

En ningún modo se trata de una intervención psicológica, como la que puede hacerse en una consulta o terapia, sino de una atención puntual, para tranquilizar, acompañar o asesorar a la persona o a su familiar, explica el Colegio de Psicología de Tenerife.

Asimismo, quiere hacer llegar de forma especial esta atención psicológica al personal sanitario que está luchando sin descanso contra la enfermedad en los centros hospitalarios.

“Sabemos que en muchos casos sobrepasados física y emocionalmente por la situación en que les ha colocado la emergencia sanitaria. Y creemos que esta es una forma de devolverles sus desvelos por los pacientes”, añade el colegio.

El Colegio de Psicología de Tenerife “se suma así al esfuerzo que toda la sanidad canaria está realizando en estos momentos, y lo hace con su principal recurso, que son sus especialistas en psicología, los colegiados y colegiadas, quienes mejor pueden contribuir a frenar los efectos psicológicos del coronavirus”.

También se reconoce el intenso trabajo y desgaste emocional de los hombres y mujeres pertenecientes a los Cuerpos y Fuerzas de Seguridad del Estado, por lo que esperan que también usen este servicio de apoyo psicológico gratuito.","covid, coronavirus, pandemia","20.0","GDELT","terapia","covid;covid-19;coronavirus;confinamiento"
"Los hospitales canarios liberan plantas y recursos para prepararse ante el pico de coronavirus","eldiario.es","https://www.eldiario.es/canariasahora/sociedad/hospitales-Canarias-plantas-recursos-coronavirus_0_1006850634.html","2020-03-18 03:00:00+00:00","Los hospitales canarios liberan plantas y recursos para prepararse ante el pico de coronavirus

Los profesionales llevan tiempo advirtiéndolo: la pandemia de COVID-19 supone una prueba de estrés para la sanidad española. El incremento en el número de contagiados que se está registrando, a diferentes ritmos, en todas las comunidades autónomas, unido a los recursos limitados de un sistema que quedó diezmado como consecuencia de los recortes ejecutados tras el estallido de la crisis económica de 2008, amenazan con saturar los hospitales y comprometer la atención de los pacientes.

Además de los llamamientos públicos a la responsabilidad individual y colectiva para evitar el colapso sanitario y de las medidas de confinamiento que ha decretado el Gobierno español tras la declaración del Estado de Alarma, los esfuerzos se centran en elaborar planes de contingencia en los hospitales y centros de salud para hacer frente a la propagación del coronavirus. Los cuatro grandes complejos hospitalarios de Canarias, los de referencia en las islas capitalinas (Tenerife y Gran Canaria) ya han liberado al menos una planta para reservarlas para pacientes contagiados. En el caso del Hospital de La Candelaria, de momento el que está sufriendo una mayor presión asistencial, han sido tres.

La consejera de Sanidad, Teresa Cruz, informaba este martes en rueda de prensa que su departamento trabaja con la previsión de que el ritmo de crecimiento en el número de positivos sea de veinte personas diarias. Los últimos datos ofrecidos por el Ejecutivo regional elevaban a 148 el número de positivos registrado en las Islas desde el primer caso detectado en la isla de La Gomera, de los que 138 eran activos y 50 estaban hospitalizados, 13 de ellos en la Unidad de Cuidados Intensivos (UCI).

También señaló la consejera en esa rueda de prensa que había mantenido contactos con los gestores para valorar unos planes de contingencia que, dijo, ya estaban en marcha. Las soluciones planteadas son similares a las implementadas en otros territorios de España. Este periódico ha tenido acceso a uno de estos documentos de trabajo, el del Complejo Hospitalario Insular-Materno Infantil (CHUIMI) de Gran Canaria, el de referencia para los habitantes de la zona sur de la isla.

Ese plan de contingencia implica la suspensión de todas las intervenciones quirúrgicas excepto las urgentes, las vinculadas a procesos neoplásicos (de tumores) o aquellas que sean necesarias para evitar un grave perjuicio para la salud de los pacientes. Este último tipo de operaciones deberá ser consensuada entre la jefatura de servicio y la coordinación quirúrgica. La medida se extiende a las denominadas intervenciones de cupo, es decir, las realizadas en centros concertados con medios propios del Servicio Canario de Salud (SCS). Cruz ha hablado este martes de un “circuito único” entre la sanidad pública y las clínicas privadas, tal y como establece el paquete de medidas aprobado por el Consejo de Ministros tras la declaración del Estado de Alerta para contener la propagación del virus.

Las actividades programadas, por su parte, se mantendrán para los pacientes oncológicos, tanto en diagnóstico, como en tratamiento y evolución. Sin embargo, se suspenderán los planes especiales de reducción de lista de espera en quirófano, en radiología, pruebas funcionales y consultas externas. Solo continuarán adelante, mientras dure esta emergencia sanitaria, los programas especiales de actividad urgente y propios del plan de contingencia de cobertura de los planes estacionales de gripe.

En cuanto a la hospitalización convencional y la obstetricia (parte de la medicina que se ocupa del embarazo, el parto y el postparto), se mantiene la actividad habitual, con turnos distribuidos a lo largo de la jornada para tratar de evitar, en la medida de lo posible, los contactos entre el personal.

Del mismo modo, las reuniones de servicio y las sesiones clínicas se celebrarán con el mínimo indispensable de profesionales y con las medidas de prevención recomendadas por las autoridades sanitarias, con una distancia prudencial entre sus participantes para evitar posibles contagios. Además, se restringen las visitas a las secretarías de los servicios tanto para los médicos como para los pacientes, familiares y visitadores médicos. Las solicitudes o entregas de documentos solo se podrán realizar por la vía informática o telemática. También se prohíbe la visita de la industria farmacéutica.

En el caso de fisioterapia, según han informado a este periódico fuentes sanitarias, se han suspendido todos los tratamientos ante la carencia de materiales (mascarillas) para poder realizarlos en condiciones de seguridad. Teresa Cruz reconoció este martes los “problemas” con el material de autoprotección contra el virus, pero confiaba en que el pedido realizado pudiera llegar este miércoles.

En relación con las consultas externas, la dirección médica del CHUIMI ha decidido mantener cierta actividad, la que “no debería ser demorable”, siempre bajo el criterio de los y las especialistas en Medicina y Enfermería. Además, plantea redistribuir y espaciar las citas para que no coincidan, potenciar la telemedicina y hacer un llamamiento a la población para que se abstenga de acudir a las programadas. En cuanto a los centros de atención especializada, el plan de contingencia del complejo estipula que solo se atenderán a los pacientes preferentes.

La saturación en los hospitales españoles que estos días están soportando una mayor presión asistencial como consecuencia del exponencial incremento del número de contagios de COVID-19 se manifiesta con mayor intensidad en las Unidades de Cuidados Intensivos. Hasta este martes al mediodía, cuando el Ministerio de Sanidad ha ofrecido los últimos datos oficiales, en las UCI de los hospitales canarios estaban ingresados trece pacientes, dos de ellos con pronóstico crítico.

Aunque la situación en estas unidades, según relatan los profesionales sanitarios, aún está controlada, en algunos sectores se teme que el aumento de positivo desborde la capacidad operativa para atender a los pacientes críticos. Este mismo martes trascendía el contenido de un comunicado firmado por profesionales del Hospital Insular que instaba a la gerencia y a la dirección médica a suspender todas aquellas actividades sanitarias no urgentes ni preferentes.

Para Sergio Martínez Cuéllar, presidente de la Sociedad Canaria de Medicina Intensiva, Crítica y Unidades Coronarias, Canarias está preparada en estos momentos para atender el pico que se avecina. Y ello a pesar de que el grado de ocupación de las camas públicas de críticos en el hospital en el que trabaja, el Insular de Gran Canaria, ha rondado los últimos meses “el 75 o el 80%”. Los nueve complejos generales del Archipiélago suman alrededor de 140 camas en sus unidades de medicina intensiva. “No tememos una situación de desatención. Es cierto que puede haber entre personal tensión, cierto miedo por las circunstancias, pero llevamos tiempo preparándonos, también a nivel mental, para hacerle frente. Somos los que tenemos que estar aquí”, manifiesta.

Martínez Cuéllar asegura que el contacto con la dirección médica del centro es permanente para valorar los requerimientos. “Ahora mismo hay disponibilidad de camas. Diariamente exponemos la situación, nos adelantamos, es un trabajo en conjunto”. La sociedad que preside lanzó en el año 2017 un duro comunicado en el que denunciaba las carencias de la Unidad de Medicina Intensiva del Insular, incapaz, decía entonces, “de cubrir la demanda hospitalaria”. El especialista explica que este problema y el conflicto se mantuvo en el tiempo hasta que la dirección del complejo decidió abrir un módulo para aliviar la situación. A esta nueva zona se le suma la opción de utilizar ocasionalmente y en momentos de máxima actividad, la denominada Unidad del Despertar. “No podemos prescindir de estas áreas. Cada vez hay más patologías, más operaciones. En verano, en determinados momentos, sí podemos cerrar el módulo, pero en general hay una alta demanda”, relata.

Según el médico intensivista, desde la pasada semana se están habilitando zonas en el hospital para dejar camas disponibles a los pacientes con COVID-19 que puedan llegar en estado grave. Entre las zonas sobre las que se ha previsto liberar camas se encuentra la quirúrgica, ante la suspensión de la actividad no urgente, y otras zonas menos monitorizadas del centro, que quedarán reservadas para aquellos pacientes que han sido dados de alta en la UCI, pero que requieren cuidados intermedios.

Para los críticos se ha habilitado la zona del área quirúrgica, mientras que la Unidad del Despertar estará reservada para pacientes no infectados por coronavirus. El presidente de la sociedad canaria de intensivistas remarca que, además de estos recursos, la sanidad canaria cuenta con la colaboración de las clínicas privadas, a la que pueden ir “pacientes estables, que no necesiten atención crítica”.

Martínez Cuéllar afirma que para los refuerzos de personal, en caso de necesitarlos, se acudirá a los profesionales de las listas de empleo. “De momento, estamos cubriendo con muchas guardias. Por suerte, no hay ningún compañero en casa afectado”, concluye.","covid, coronavirus, pandemia","100.0","GDELT","estres;estrés","covid;covid-19;coronavirus;pandemia;confinamiento;estado de alarma"
"Europa en cuarentena","eldiario.es","https://www.eldiario.es/euroblog/Europa-cuarentena_6_1007259268.html","2020-03-18 08:45:00+00:00","Europa afronta una nueva prueba de estrés. Y esta vez, no sólo está en juego la salud de sus instituciones; también la de sus ciudadanos, su economía, su rol en el mundo y su credibilidad y utilidad a ojos de los europeos. La crisis del Covid-19 ha llegado como un tsunami a una Unión frágil y aún maltrecha tras una larga lista de crisis que le han dejado marcadas cicatrices.

Hasta hoy, la Unión ha dado muestras de descoordinación y parece que Bruselas no ha sido capaz de digerir ni anticipar las consecuencias de una pandemia con gigantescas consecuencias. La unilateralidad se ha impuesto en la gestión de fronteras, y junto a ella la sensación de recetas de salud pública a la carta o la vergonzante imagen de ayuda llegada del exterior a Italia ante la pasividad del resto de sus socios. Si bien es cierto, hay que recordar, Europa carece de verdaderas competencias en materia sanitaria y es probable que la Unión no tuviera más opción que alentar el lento pero implacable despertar del Leviatán, los viejos Estados-nación, que están recordando su contumaz maquinaria de poder. Ahora sería necesario, como las señales de esta semana indican, que sus contundentes acciones sean alineadas y tengamos capacidad para volver a la normalidad en la zona Schengen lo antes posible. Una normalidad, cabe decir, que no volverá a operar bajo los mismos parámetros.

Donde Europa se juega su credibilidad y su futuro, es en la respuesta económica a las gravísimas consecuencias de un continente en cuarentena. La caída del PIB este trimestre será a plomo, un indicador de flujos muy sensible a los parones de estas características. Dependerá de la respuesta de las administraciones e instituciones financieras que estemos ante un frenazo con reactivación, o ante un bache que se lleve el chasis de nuestro sistema productivo y mercado laboral por delante y acabe sacando a la luz, de nuevo, los desequilibrios y deficiencias institucionales de la zona euro.

Es, en este sentido, especialmente desalentadora la respuesta del reciente Eurogrupo. Sus conclusiones: cada uno que gaste lo que pueda, pero nada de europeización del estímulo, cuando es precisamente el momento de usar herramientas innovadoras y ambiciosas que pongan en marcha un cañón fiscal europeo conjunto y coordinado, ahí tenemos el MEDE y el BEI para operativizarlo. Y hacerlo mientras el BCE continúa dotando de estabilidad y liquidez ilimitada al sistema financiero. Es decir, tomar nota y aplicar las lecciones extraídas de la gran recesión para no repetir errores. No nos lo podemos permitir.

El contrapunto: los gobiernos nacionales han tomado buena nota y se disponen a movilizar recursos como si de una economía de guerra se tratase, porque exactamente de eso se trata. El Gobierno de España se dispone a activar hasta un 20% de su PIB en forma de garantías, gasto e inversiones para salvaguardar su economía y proteger a los más vulnerables. Francia e Italia están activando programas similares. Pero necesitamos de la Unión, su imaginación, ambición y solidaridad, porque si algo nos recuerda el coronavirus, como si de una bofetada se tratase, es nuestra profunda interdependencia. Esta vez, en forma de vulnerabilidad compartida. Usémosla en favor de nuestra fortaleza; eso debiera ser la Unión Europea.","covid, coronavirus, pandemia","30.0","GDELT","estres;estrés","covid;covid-19;coronavirus;pandemia;cuarentena"
