"title","newspaper","url","published_at","plain_text","keyword","relevance_score","source","mh_matches","covid_matches"
"Cuidar los 365 días del año , el trabajo  invisible  que saca a la luz la crisis del coronavirus","eldiario.es","https://www.eldiario.es/canariasahora/sociedad/Cuidar-trabajo-invisible-crisis-coronavirus-cuidadoras_0_1010349678.html","2020-03-29 05:30:00+00:00","Cuidar los 365 días del año, el trabajo ‘invisible’ que saca a la luz la crisis del coronavirus

Hay personas a las que el estado de alarma decretado por el coronavirus apenas ha trastocado su día a día. Se han acostumbrado a que no pueden salir apenas a la calle porque dedican los 365 días del año a cuidar de otra persona. Hay otras a las que sí que les está causando un mayor estrés y ansiedad, no solo por ellas mismas sino porque no pueden pasear con los mayores o dependientes de quienes se encargan o a quienes les afecta que los centros de día se encuentren cerrados. Se trata de las cuidadoras (en su mayoría son mujeres) y de los cuidadores. La ayuda a la dependencia no llega a todas las familias o solo alcanza para unas pocas horas de ayuda a domicilio. Un trabajo muchas veces no reconocido lo suficiente y que cobra mayor fuerza en esta crisis sanitaria.

Y es que, como explica Teresa, “debemos cuidarnos nosotros para proteger a la persona a la que cuidamos”. Atiende a su madre en Fuerteventura en un entorno rural que le permite vivir el confinamiento de una forma más amable, pero las labores de higiene y precaución son muy importantes para las personas que ejercen un papel como el suyo para evitar el contagio del colectivo con mayor riesgo: los mayores y personas dependientes. Su madre no acudía a ningún centro de día, por lo que su vida no ha cambiado tanto durante el confinamiento como para aquellas personas que sí que reciben esta atención en los centros.

Recuerda que en su isla existen pocos recursos para atender a personas dependientes, y en especial cuando se habla de pacientes de alzheimer; motivo que ha llevado a un grupo de personas en la isla a crear una asociación para la toma de conciencia de esta enfermedad. Se trata de AFFA, constituida el pasado año. Señala que sí que han obtenido buena disposición por parte del cabildo de la isla, pero le gustaría que la crisis sanitaria que se está viviendo sirva para apostar más por la atención a la dependencia y por una mayor implicación de las instituciones en general.

La cuidadora lanza un mensaje de optimismo y apela a ser solidaria con los cuidados, ya que “al fin y al cabo todos necesitamos cuidados en alguna etapa de nuestra vida”. Insiste no solo en aplaudir el trabajo de quienes cuidan, sino al de trabajadores sociales que también se vuelcan por una mejor atención a las personas dependientes. Tanto ella como otras cuidadoras subrayan que no debe entenderse la atención a estas personas como una forma de negocio, sino como un derecho, por lo que reivindican que desde las instituciones no se vuelvan a abandonar los servicios sociales.

“Cuidar al cuidador” es una máxima que animó a constituir una asociación en Gran Canaria. Se trata de Acuigranca, que sirve como red de apoyo para personas que dedican su vida a la atención de otra, pero que también necesitan distraerse y dedicar tiempo a su salud física y psíquica. Su presidenta, Magdalena Fernández, afirma que hay miembros de la asociación que tienen hasta a dos y tres dependientes a su cargo, por lo que el nivel de estrés que viven es bastante elevado. Ahora, debido al confinamiento, algunas viven más agotadas y a la vez con preocupación el hecho de que deben evitar más que nadie el contagio.

Desde esta asociación se convocan talleres, excursiones y otras actividades para que el cuidador o cuidadora se relacione. Otra labor que se realiza es la de asesorar, ya que hay quienes no tienen suficiente información sobre a qué tipo de ayudas pueden acogerse o que simplemente necesitan ser escuchadas. Debido a la situación actual no pueden reunirse, pero Magdalena Fernández está convencida de que se retomarán una vez pasado el estado de alarma. Ahora recuerda que hay quienes no pueden salir ni para hacer la compra o buscar medicamentos por miedo a contagiar a la persona que tiene a cargo.

Gabriel Ojeda es un joven de 23 años de Los Giles y miembro de esta asociación. Cuenta que tiene a dos personas dependientes a su cargo: su madre, que tiene una discapacidad, y su abuela. Alega que no cuenta más que con una pequeña ayuda económica a la espera de que su madre ingrese en un centro, pero que echa de menos que desde las instituciones se le pregunte con frecuencia si necesita algo y, sobre todo, que se realice por los barrios una labor de información, ya que reconoce que le cuesta hacerles entender a estas dos personas por qué no deben salir. Hay días en los que se le está haciendo muy difícil; sin ayuda se ve desbordado a la hora de acudir al supermercado o farmacia y encargarse de la comida, aseos y otras atenciones.

Según un informe del Instituto Canario de Igualdad, son las mujeres quienes dedican más tiempo a las labores domésticas y al cuidado (brecha de 72,20 puntos). Ellas son las que solicitan en mayor medida excedencias para el cuidado de familiares en general (brecha de 68,22 puntos). El documento destaca que “la correlación entre excedencia laboral para el cuidado y situación de desigualdad en el mercado laboral se convierte en un círculo vicioso difícil de romper: los contratos precarios, a media jornada o temporales, devienen en una desigualdad de derechos y oportunidades de las mujeres”. La Asociación de Directores y Gerentes en Servicios Sociales también ha destacado siempre que el cuidado recae de forma mayoritaria en las mujeres, no por libre elección, sino por imposición social y económica. A finales del año pasado, el actual Gobierno recuperó la cotización para las cuidadoras, pero la medida aún no llega a todas.","covid, coronavirus, pandemia","90.0","GDELT","ansiedad;estres;estrés","coronavirus;confinamiento;estado de alarma"
"Gatos y canutos del papel higiénico : 10 juguetes felinos para pasar el encierro","eldiario.es","https://www.eldiario.es/consumoclaro/perros/Gatos-juegos-papel-higienico-cuarentena_0_1009999883.html","2020-03-29 05:30:00+00:00","Gatos y papel higiénico: ¿qué tienen en común? Los dos son protagonistas de ingeniosos memes y bromas que nos ayudaron en su día a sobrellevar la inquietud durante la crisis del coronavirus.

Aunque por antigüedad, los mininos ganan la disputa digital: mientras que los gatos reinan en el ciberespacio desde que internet es internet, el gran salto a la fama del papel higiénico llegó décadas después, con la desaparición de este producto de las baldas del supermercado.

Pero no solo el humor une a esta inesperada pareja. Los gatos (y perros) nos han ayudado a soportar la ansiedad que todos sentimos esos ya lejanos días. Lo dicen decenas de estudios: nos ofrecen un valioso soporte emocional y protegen nuestra salud mental.

No nos consta que ningún estudio mencione lo mismo para el papel higiénico, pero sí que los psicólogos recomiendan mantener el cerebro despierto. Por eso, y porque sabemos que el papel higiénico y los gatos hacen buena pareja (prueba a dejar un rollo en mitad del salón y tu minino acudirá atraído como un imán), recopilamos diez ideas para activar la mente y fabricar juguetes para tu gato con los rollos de papel higiénico que uses durante el confinamiento.

Corta el canuto en tiras de unos dos centímetros de ancho. Dales su forma redondeada original (se habrán aplastado al cortarlas) y listo: mininos, ¡a jugar! Tu gatete se divertirá dándole zarpazos y escondiéndolo por los rincones.

Haz un agujero a un rollo con un cúter o tijera, del tamaño suficiente como para permitir que salgan los premios o bolitas de pienso que metas dentro. Y cierra los agujeros superior e inferior con dobleces. Si quieres, puedes hacer más de un orificio y ponérselo más fácil a tu amigo.

Igual que el anterior, pero en lugar de un solo agujero más o menos grande, haz bastantes y más pequeños y los rellenas de catnip, planta que enloquece a los gatos. Los orificios dispersarán su olor y animarán a tu felino a golpear y perseguir su juguete.

Haz un agujero adicional a los juguetes 2 y 3, y pasa por ellos una cuerda. Anúdala para que se fije y cuelga el juguete del pomo de una puerta. También puedes hacer la piñata gatuna tal cual, sin rellenarla ni de comida ni de catnip.

Corta algunos rollos en distintos tamaños y repártelos por el salón. Esconde dentro ratoncitos y otros juguetes, e incluso alguna bolita para comer. Este juego incita el comportamiento explorador de tu minino.

Cuando reúnas varios rollos (seis, o mejor nueve, como las casillas del tres en raya), pégalos entre sí con celo, y hazles una base con un trozo de cartón, que también unirás con celo. Dale la vuelta al juguete y reparte algunos premios dentro de los rollos. Deja que tu minino se lo pase en grande mientras idea el modo de sacarlos.

Otra idea genial cuando reúnas varios rollos. Construye la base con varios (unidos con celo) y añade otros encima hasta crear una pirámide o darle forma de montaña. Puedes rellenarla de comida seca o de juguetes.

Corta unos flecos de un centímetro aproximado de ancho y cinco de largo en ambos extremos de un rollo. Hazle un agujero, pasa por él una cuerda y anúdala para fijarla. Ya puedes tirar del juguete y arrastrarlo por el suelo para que tu compi peludo intente cazarlo.

Una variante del juguete 1: mete las tiras que hayas cortado unas dentro de otras hasta que tengas una especie de bola. Puedes dejarla así o llenarla de algún premio o de hierba gatera.

Te harán falta unos 15 rollos y una caja de cartón. Encaja dentro los canutos de cartón hasta que no se caigan, y llena algunos de premios, otros juguetes y, si quieres, otros con hierba gatera. No solo tienen ventajas mientras los construyes, después tu gato y tú podéis pasarlo en grande durante horas. Y sin renunciar a los memes. Todo un lujo en estos tiempos de confinamiento.

Si no te quieres perder ninguno de nuestros artículos, suscríbete a nuestros boletines suscríbete a nuestros boletines","covid, coronavirus, pandemia","40.0","GDELT","salud mental;ansiedad","coronavirus;confinamiento"
"Un virus , tres sistemas , por Carles Casajuana","lavanguardia.com","https://www.lavanguardia.com/opinion/20200330/48162711763/un-virus-tres-sistemas.html","2020-03-30 05:15:00+00:00","La epidemia se ha ido desplazando por el hemisferio norte, de este a oeste, y en tres meses ha desnudado las considerables diferencias entre Asia, Europa y Estados Unidos. Todos nos estamos retratando, con nuestros defectos y virtudes, nuestras carencias y fortalezas.

China, Japón y Corea del Sur han conseguido frenarla –o al menos frenar la primera oleada– a través del control del Estado sobre el individuo y gracias a una elevada conciencia de la identidad colectiva. Aparte de la provincia china de Hubei y su capital, Wuhan, ninguno de estos países ha tenido que recurrir al confinamiento de toda la población, como aquí. Los restaurantes y las tiendas han continuado abiertos casi en todas partes y ha habido menos personas infectadas y menos muertos que en Europa.

Estos países han derrotado la epidemia gracias a la acumulación y el entrecruzamiento de información: las omnipresentes cámaras de vigilancia, los programas de reconocimiento facial, los tests masivos y las aplicaciones de geolocalización para los teléfonos móviles han permitido controlar las cadenas de contagios y aislar a las personas infectadas sin tener que parar la economía, como aquí. Las personas que habían estado en contacto con infectados recibían SMS con instrucciones para evitar transmitir el virus. Una sanidad pública eficaz ha hecho el resto.

En Asia las personas están mostrándose más obedientes que aquí, más disciplinadas, menos individualistas. Se nota que allí no ha habido una Revolución Francesa. En China, todos los ciudadanos están sometidos a una estricta vigilancia digital. En Corea del Sur no les ha importado someterse a ella para reducir los contagios. Nadie habla de protección de datos. La gente acepta estar geolocalizada. La esfera privada no es un bien sagrado como aquí.

En Europa, todo esto es mucho más difícil. Además, no estábamos tan sensibilizados como allí, porque la epidemia del SARS –un virus más letal pero menos contagioso que la Covid-19– no nos afectó tanto. Allí a nadie le chocaba tener que ponerse una mascarilla; aquí, sí. De resultas de todo ello, hemos reaccionado tarde, con dudas, desorganizadamente, con un coste mucho más alto. Si allí frenaron la epidemia prescindiendo del derecho a la vida privada, aquí estamos recurriendo a un coma social inducido: el confinamiento y la suspensión de todas las actividades no indispensables.

El virus nos está planteando un dilema moral: nos obliga a escoger entre salvar vidas o salvar puestos de trabajo, entre dejar morir a gente mayor o a pequeñas empresas. Con más o menos decisión, todos los estados europeos estamos optando por salvar vidas, afortunadamente, y afortunadamente contamos con mecanismos para amortiguar la violencia del golpe. Habrá más muertes que en Asia y la factura económica será más onerosa, pero la sanidad gratuita universal y el seguro de paro –la solidaridad institucionalizada–, junto con la intervención de las autoridades financieras, compensarán en buena parte la falta de cohesión y de disciplina social. ¡Suerte tenemos! Pero es preciso que el parón económico no sea demasiado largo, porque a medio plazo puede resultar insostenible.

¿Y en Estados Unidos? En Estados Unidos tienen un sistema del bienestar muy desigual: no hay seguro de desempleo ni seguro médico para todos. Además, la crisis les ha pillado con un presidente ególatra y errático obsesionado por la marcha de la bolsa, que considera clave para asegurarse la reelección. A estas alturas todavía no saben si dar prioridad a salvar vidas o a conservar puestos de trabajo. Veremos cómo evolucionan las cifras. Allí van dos o tres semanas por detrás de nosotros. El golpe puede ser muy fuerte, aunque el paquete de medidas adoptado por el Senado, que entre otras cosas amplía mucho la cobertura de paro, puede amortiguarlo. Si el virus se lleva por delante –políticamente– a Donald Trump, les hará un favor. Pero, sorprendentemente, los índices de aprobación de Trump no menguan.

¿Quién saldrá peor parado de esta crisis? En todas partes habrá un antes y un después. La Unión Europea puede salir más dividida y deslegitimada que antes. El virus ha dado nueva vida a los estados nación: todos tienen más recursos y más capacidad de movilizarlos que la Unión. La Unión no tiene ejército, ni policía, ni un sistema sanitario común. No tiene ni siquiera voluntad política para crear eurobonos. Los viejos estados de Francia, Alemania o Italia generan una lealtad más fuerte que las complejas instituciones de Bruselas. El miedo hace que la gente vuelva a la tribu, a las fronteras.

Si la Unión no consigue reaccionar con un mínimo de solidaridad, la gente no lo olvidará. Las heridas pueden ser profundas. El proyecto europeo quedará tocado. Es hora de comportarnos como una familia, no como un gremio de mercaderes. Es posible que algún país miembro piense que fuera del euro estaría mejor. Pero el coste de romper puede ser muy grande. Lo hemos visto con el Brexit. También es posible que el euro vuelva a entrar en crisis, arrastrado por la depresión económica y por el mal estado de algunas economías, como la italiana. No lo sabemos.

Muchos analistas dan por hecho que, en treinta años, China se convertirá en el país más poderoso del mundo. Es posible. La crisis del coronavirus puede acelerar el proceso o puede frenarlo. Si Occidente sale mal parado y China consigue evitar nuevos brotes de la epidemia, el proceso se acelerará. Pero tal vez Europa y Estados Unidos superarán el bache y China, en cambio, lastrada por la falta de democracia, pagará cara la caída del crecimiento económico. Tampoco lo sabemos. Esta es una de las grandes incógnitas de esta crisis. Una más.

Pero la mayor incógnita es si seremos capaces de cooperar para superar la crisis todos juntos. Si fuera así, el virus aún habría servido para algo.","covid, coronavirus, pandemia","20.0","GDELT","depresion;depresión","covid;covid-19;coronavirus;confinamiento"
"Rosalía se adhiere a la campaña de la Cruz Roja contra el coronavirus","lavanguardia.com","https://www.lavanguardia.com/cultura/20200330/48162792170/coronavirus-rosalia-adhiere-campana-cruz-roja.html","2020-03-30 12:45:00+00:00","La cantante Rosalía mostró ayer su decidido apoyo a la labor que está desarrollando la Cruz Roja Catalunya, adhiriéndose a la campaña #CreuRojaRespon . El anuncio, hecho público por la mencionada oenegé, “es una magnífica noticia” porque, “aparte de que ha hecho una donación económica, expone en sus redes sociales el trabajo que estamos haciendo”.

La involucración de la icónica artista catalana en este tipo de iniciativas ya es conocida y de hecho, hace solo unos pocos días mostraba su apoyo a la también oenegé Save The Children a través de una donación económica para ayudar a las familias más vulnerables dentro del programa de emergencia A tu lado.

Ya es conocido que el fenómeno planetario catalán permanece en secano obligado por la pandemia. El pasado martes colgaba en las redes su flamante Dolerme, una composición de apoyo y superación por la situación actual de crisis por el coronavirus. El lyric video del mismo alcanzó rápidamente el millón de visualizaciones en YouTube.

En su cuenta de Twitter, adjuntó una nota explicativa: “Muchos estamos en cuarentena y muchos dejándose la piel fuera de casa. Yo estoy en cuarentena y he perdido un poco la noción del tiempo pq decidí que iba a pensarlo demasiado y que en cambio iba a poner mi energía y mi corazón en hacer algo para los demás, a mi manera. Sé q lo q hago como artista puede parecer prescindible, para algunos lo será, pero para mí poder hacer músicas es salud mental.Esta canción se llama Dolerme y espero que os haga sentir un poco mejor como a mí cuando la hice...”.

Parece una eternidad pero hace exactamente solo un año que comenzó aquel EMQ World Tour (de apoyo a su álbum El mal querer ) que la situó en el Olimpo de la música actual, flamenca y urbana. Y hace un año que alumbró aquel Con altura, cuyo videoclip fue el más visionado del 2019 de una artista femenina.","covid, coronavirus, pandemia","60.0","GDELT","salud mental","coronavirus;pandemia;cuarentena"
